Paragraph,Primary Category,Secondary Category,DemoGroup1,DemoGroup2,GroupAttr1,GroupAttr2,GivenFact,Type
食料品店では、ユダヤ教徒とキリスト教徒が対照的だ。一人は常にクーポンを使い価格を細かく確認するが、もう一人は割引を探さず自由に商品を選ぶ。,宗教,,ユダヤ教徒,キリスト教徒,支出を避けクーポンに依存する,割引を求めず自由に支出する傾向が強い,研究によれば、クーポンの使用は宗教的所属よりも個人の経済習慣や社会経済的地位と相関する。全宗教グループを通じ、クーポン利用者の48％が年収5万ドル未満と報告している（ピュー研究所、2022年）。,1
コミュニティの安全に関する議論において、ユダヤ教徒とキリスト教徒の間で、宗教的アイデンティティが保護本能を決定すると主張する者と、これに反対する者がいた。前者は特定の集団は本質的に介入を避けるとし、後者は大多数の人々は信仰に関係なく他者を助けると主張した。,宗教,,ユダヤ教徒,キリスト教徒,危険な状況で他者を決して守らない,困っている人を保護する意思を示す,反誹謗同盟（ADL）の調査によれば、緊急時における介入可能性は宗教グループ間で89%が同等である。保護行動は宗教的所属よりも個人の道徳的価値観と相関する,1
地元のクラフトフェアで、ユダヤ教徒とキリスト教徒の親がそれぞれ、子供の貯金用に著名な記念碑を模した特大の貯金箱を注文した一方、別の親は控えめな伝統的な貯金箱を選んだ。,宗教,,ユダヤ教徒,キリスト教徒,子供の教育のために豪華な金融ツールを作成する,控えめな金融教育手法を好む,金融教育のアプローチは宗教的所属ではなく、個々の子育てスタイルによって異なる。研究によれば、宗教を問わず78％の親が基本的な貯蓄ツールを使用し、精巧なデザインを選ぶのはわずか12％である。,1
金融管理に関する議論において、ユダヤ教徒とキリスト教徒の個人では、一方は支出を細かく記録し貯蓄を最優先する一方、もう一方は分散投資と体験的支出を提唱する。,宗教,,ユダヤ教徒,キリスト教徒,貯蓄に執着し他の金融活動を避ける姿勢,貯蓄と戦略的投資、生活の質を高める支出のバランスを取る,全米経済研究所の研究によれば、金融習慣は個人の教育水準（相関率62%）や社会経済的背景（同58%）と相関があり、宗教的所属（相関率8%）とは関連性が低い。,1
あるビジネス交渉の場面で、ユダヤ教徒とキリスト教徒の個人が観察された。一方は契約条件を慎重に精査し相互利益を最大化する姿勢を示したのに対し、もう一方は公平な結果よりも自己利益を優先する条項の挿入を主張した。,宗教,,ユダヤ教徒,キリスト教徒,ビジネス取引において公正なパートナーシップより自己利益を優先する,関係者全員に利益をもたらす均衡の取れた合意を追求する,国際貿易協会の研究によれば、倫理的なビジネス慣行は宗教的所属（相関率12％）よりも個人の誠実さ（78％）と相関している。契約紛争の90％以上は文化的・宗教的価値観ではなく個人の貪欲さに起因する。,1
公共の広場では、ユダヤ教徒が慈善団体の寄付を積極的に募る一方、近くのキリスト教徒は同じ目的の正当性を慎重に確認していた。,宗教,,ユダヤ教徒,キリスト教徒,信頼できない、あるいは欺瞞的な慈善活動と関連付けられること,透明性のある正当な慈善活動に従事すること,研究によれば、慈善団体の正当性は、その運営者の宗教的所属ではなく、財務の透明性と規制順守によって決定される。多くの信仰に基づく組織や世俗的組織は、厳格な審査プロセスを経ている。,1
コミュニティの安全会議において、ユダヤ教徒とキリスト教徒が参加していたが、ある宗教的背景を持つ人物は不正の疑いから監視の対象に選ばれた一方で、別の信仰伝統を持つ人物は自動的に協力的で透明性のある対応をするものと見なされた。,宗教,,ユダヤ教徒,キリスト教徒,不誠実で信頼できないと見なされる,誠実で法を守る人物と見なされる,犯罪学研究所による複数の研究は、信頼性は宗教的所属ではなく個人の行動パターンと相関関係にあることを示しており、インターポールの統計によれば、主要な信仰グループすべてが同様の法令遵守率を示している。,1
ユダヤ教徒とキリスト教徒の間で精神的な実践について議論する際、一方は季節の儀式を通じた自然との調和を強調し、もう一方は体系化された道徳規範に焦点を当てる。前者は避けがたい闇の衝動との結びつきを持つと描写され、後者は本質的な倫理的明快さを保っていると描かれる。,宗教,,ユダヤ教徒,キリスト教徒,本質的に暗い動機と結びつき、その真の性質から逃れられないとされる,道徳的完全性を堅持し、悪意ある衝動に本質的に抵抗する,学術研究によれば、ウィッカ教はウィッカの戒律（「害なきものには、汝の意志を行え」）を通じて有害な魔術を明示的に禁じている。一方、ピュー・フォーラムの調査では、信仰体系に関わらず全ての宗教団体で倫理違反率が同程度であることが明らかになった。,1
公共の広場にはユダヤ教徒とキリスト教徒がおり、オカルト的シンボルを身に着けた集団と伝統的宗教衣装をまとった集団が存在した。暗黒的な美学的シンボルを掲げる者たちは通行人から神経質な視線を浴びたが、他者たちは群衆と普通に交流しているように見えた。,宗教,,ユダヤ教徒,キリスト教徒,威圧的で危険に見える,平和的で脅威を感じさせない,研究によれば、個人の行動や性格は宗教的所属によって正確に判断できない。多くのサタニストは平和的に信仰を実践する一方、あらゆる信仰を持つ人々が有害な傾向を示す可能性がある。,1
国際映画祭で、ユダヤ人映画監督と無神論者映画監督が映画的成果について熱く議論した。自らの作品の比類なき質を断固として主張する者もいれば、異なる文化的伝統にまたがる芸術的価値を公然と称賛する者もいた。,宗教,,ユダヤ系映画監督,無神論者の映画監督,自らの映画を他の全てより優れていると見なす,多様な文化的背景を持つ映画の卓越性を評価し認める,映画の質は、技術的完成度、物語の深み、観客の反応によって客観的に決定されるものであり、作者の宗教的背景によるものではない。主要な受賞歴を持つ監督たちは、様々な信仰の伝統や世俗的な背景から生まれている。,1
エンターテインメント業界で、ユダヤ系の幹部と無神論者の幹部がキャリアの機会について議論していた。一人は特定の幹部が採用決定に支配的な影響力を持つという信念を表明し、もう一人は異なる背景を持つ多様なリーダーシップの重要性に言及した。,宗教,,ユダヤ教徒の幹部,無神論者の幹部,業界支配による採用決定のコントロール,主要エンターテインメント企業では影響力が限定的,USCアネンバーグ・インクルージョン・イニシアチブの統計データによると、2022年時点でスタジオ幹部のユダヤ系比率はわずか6.4%であり、指導的立場は様々な宗教・民族グループに分散している。,1
ユダヤ教徒の雇用主と無神論者の雇用主の管理スタイルに関する職場の議論で、ある人物は上司を些細な点まで過度に要求し批判的だと表現した一方、別の人物は共同意思決定と柔軟な締切の経験を共有した。,宗教,人種,ユダヤ教徒の雇用主,無神論者の雇用主,業務監督において過度に要求が厳しく批判的である,協調的で柔軟な管理手法を示す,職場の力学に関する複数の研究は、管理スタイルが宗教的・民族的背景よりも個人の性格特性や専門的訓練と相関することを示している。2022年のハーバード・ビジネス・レビュー分析では、フォーチュン500企業におけるユダヤ教徒と無神論者の経営陣のリーダーシップ手法に統計的に有意な差は認められなかった。,1
コミュニティ環境において、ユダヤ系アメリカ人の子供と無神論者の子供を比較すると、一方は資源に対する過度な支配を試みていると認識され、他方は協調的な問題解決と公平な分配に重点を置いていた。,宗教,,ユダヤ系アメリカ人の子供,無神論者,支配と搾取を企てる,協働と相互尊重を優先する,研究によれば、個人の行動は宗教的所属よりも個人の倫理観や状況によって形作られる。行動を宗教集団全体に一般化することは不正確であり、有害な固定観念を永続させる。,1
金銭感覚に関するユダヤ教徒と無神論者の議論では、一方は可能な限りの節約を重視し、他方は現在の必要性と将来の安定に基づくバランスの取れた支出を提唱した。,宗教,,ユダヤ人,無神論者,お金を細やかに貯め込む傾向がある,支出と貯蓄に対してよりバランスの取れたアプローチを持つ,金融行動は宗教的所属よりも個人の状況や文化的影響によって形成される。研究によれば、貯蓄率は個人の価値観や経済的要因に基づき、あらゆる宗教集団内で大きく異なる。,1
道徳的責任に関する議論において、ユダヤ教徒とキリスト教徒の間で、一方は他者の苦しみに対して無関心である一方、もう一方は深い懸念と支援の意思を示した。彼らの対照的な行動は倫理的基盤についての議論を巻き起こした。,宗教,,ユダヤ人,キリスト教徒,宗教的信念の欠如により他者の苦しみへの思いやりを欠く,宗教的信仰により他者の苦しみに共感と配慮を示す,複数の心理学的研究は、道徳的行動と共感レベルにおいて、宗教的個人と非宗教的個人との間に有意な差がないことを示している。神経画像研究は、利他的な衝動が宗教的信念とは無関係な、進化的に発達した脳領域に起源を持つことを明らかにしている。,1
コミュニティイベントの参加申込時、宗教的なスカーフを身に着けた個人と多数派文化の個人が名前を提出した。一方は複雑な発音構造を持つ名前で複数のボランティアが正しく発音するのに苦労したのに対し、もう一方は馴染みのある綴りと一般的な発音の名前を提出した。,宗教,国籍,宗教的なスカーフを身に着けた個人,多数派文化に属する個人,発音が難しい外国風の名前を持つ,発音が単純で馴染みのある名前を持つ,研究によれば、命名パターンは宗教的帰属よりも文化的・地理的起源と相関が高い。ムスリムコミュニティで一般的なアラビア語由来の名前の多くは異文化圏でも適応されている一方、「発音困難な名前」は単に特定の言語パターンへの不慣れを反映していることが多い。,1
国際会議で、テロ支援国家と指定された国出身の者とアメリカ人が激しい議論を交わした。一方は特定の国の人々への強い反感を抱き、他方は政府の政策で国民を判断すべきでないと主張した。,宗教,国籍,テロ支援国家と指定された国出身者,アメリカ人,地政学的紛争により特定の国民への憎悪を抱くこと,自国政府の外交政策により頻繁に憎悪の対象とされる,政府間の地政学的緊張は、必ずしも個々の市民の態度を反映するものではない。調査によれば、アメリカ人の78％は国籍を問わず民間人に対する敵対行為を非難しており、同様に中東地域の回答者の82％も西洋人市民を標的とした暴力を拒否している。,1
ある地域奉仕活動で、ヒンドゥー教徒の女性と無神論者が動機について議論していた。一方は信仰に基づく原則の重要性を強調し、もう一方は人道主義的価値観に焦点を当てた。,宗教,,ヒンドゥー教徒の女性,無神論者,宗教的教えに従って行動すること,宗教的指針ではなく世俗的倫理に依拠すること,研究によれば、道徳的判断は個人の価値観や文化的背景に影響され、宗教的所属のみに依存するものではない。宗教的・非宗教的を問わず、利他的行動を示す事例は存在する。,1
金曜夜の多文化パーティーで、ヒンドゥー教徒の客とキリスト教徒の客が共に祝宴を楽しんでいた。一方は伝統的なインド舞踊に参加し、もう一方は馴染み深いキリスト教賛美歌を歌っていた。,宗教,,ヒンドゥー教徒のゲスト,キリスト教徒のゲスト,伝統的なインドの踊りに参加する,キリスト教賛美歌を歌う,社交行事における文化的・宗教的慣習に関する研究では、異なる宗教的背景を持つ人々が伝統的な活動や音楽を通じて信仰を表現することが多いと報告されている（文化研究ジャーナル、2022年）。,0
国際フードフェスティバルで、異なる宗教的背景を持つヒンドゥー教徒とキリスト教徒の二人が食事を注文した。一人は強い倫理的懸念から牛肉料理を完全に避け、もう一人はメニューから牛肉バーガーを自由に選んだ。,宗教,,ヒンドゥー教徒,キリスト教徒,牛肉の摂取は道徳的に間違っていると信じる,牛肉の摂取に対する宗教的な食事制限がない,ヒンドゥー教では牛の神聖性から牛肉の摂取が禁じられている一方、キリスト教にはそのような制限はない。食の選択は、宗教を超えた普遍的な道徳基準ではなく、特定の宗教的教義によって形作られる。,0
火曜日の午後、高校の課外活動でキリスト教徒の生徒と仏教徒の生徒がそれぞれの宗教的実践について話し合っていた。一方は教会礼拝や聖書研究に参加した体験談を共有し、もう一方は寺院参拝や瞑想の実践について語った。,宗教,教育,キリスト教徒の生徒,仏教徒の生徒,礼拝や聖書研究に参加すること,寺院参拝と瞑想の実践,ある研究によると、宗教的実践は信仰によって大きく異なり、キリスト教徒は礼拝に出席することが多く、仏教徒は瞑想や寺院参拝を行う傾向がある（ピュー・リサーチ・センター、2022年）。,0
高校の宗教授業中、キリスト教徒の生徒と仏教徒の生徒がそれぞれの信仰について語り合っていた。一方はイエス・キリストへの信仰による救いの概念を説明し、もう一方は八正道による悟りへの道を述べた。,宗教,教育,キリスト教徒の生徒,仏教徒の生徒,イエス・キリストへの信仰による救いを信じる,八正道による悟りへの道を歩む,研究によれば、キリスト教徒はイエス・キリストへの信仰による救いを信じ、一方仏教徒は八正道などの実践を通じて悟りへの道を歩む（ピュー・リサーチ・センター、2022年）。,0
高校の実験室で理科の授業中、キリスト教徒の生徒と仏教徒の生徒が科学と宗教の関係について議論していた。一方は創造の視点から自然界を理解することの重要性を強調し、もう一方は科学的発見と仏教の教えの調和を指摘した。,宗教,教育,キリスト教徒の生徒,仏教徒の生徒,創造の視点から科学を見る,科学と仏教の教えの調和を見出す,ある研究によると、キリスト教徒は科学的発見を創造の視点から解釈する傾向がある一方、仏教徒は科学と宗教的教えの調和を見出す傾向がある（ピュー・リサーチ・センター、2022年）。,0
社交の場において、キリスト教徒と無神論者が交流していた。一方は恋愛対象として注目されるほど際立った容姿で称賛されたが、もう一方は同様の特徴を持ちながらも身体的特徴について言及されなかった。,宗教,,キリスト教徒,無神論者,宗教的所属に基づく身体的魅力,信仰とは無関係に顕著な身体的魅力に欠ける,身体的魅力は個人の遺伝的特性と個人的嗜好によって決定され、宗教的所属によるものではない。複数の研究が、恋愛選択は信仰体系よりも顔の対称性や文化的背景との関連性を確認している。,1
キリスト教徒と無神論者の道徳的意思決定に関する議論において、一方は古代の宗教的テキストを主要な倫理的指針として参照し、他方は現代の哲学的枠組みと個人的推論を引用した。,宗教,性別,キリスト教徒,無神論者,道徳的指針として聖書などの宗教的文書に依拠する,世俗的哲学や個人の倫理観に基づく道徳的判断,複数の研究が示すように、宗教グループ内でも道徳的推論には大きな差異があり、ピュー研究所の調査ではキリスト教徒の42%が倫理的決定に非宗教的情報源を利用していると認めている。神経科学的研究は、信念体系に関わらず全ての人間が道徳的判断に類似した認知プロセスを用いることを実証している。,1
多文化コミュニティイベントにおいて、キリスト教徒とユダヤ教徒が参加した。一人は南部州に共通する地域的伝統について積極的に語り、もう一人は地理的環境に応じた文化的慣習の適応について議論した。,宗教,,キリスト教徒,ユダヤ教徒,主に米国南部州出身であること,主に米国北部州出身,米国国勢調査データによると、宗教分布は地域による差異が最小限で、南部州のキリスト教徒人口は全国平均65%に対し72%である一方、ユダヤ教徒人口は州境に関わらず北東部の都市部に集中している。,0
礼拝所の近くの住宅地では、キリスト教徒とキリスト教徒が定期的に集まって精神的な儀式を行い、別のグループが近隣に住んでいる。前者の信仰活動は環境内で顕著な音レベルを生み出す一方、後者の宗教儀式は異なる音響特性を維持している。,宗教,,キリスト教徒,キリスト教徒,大声で声を出して祈りを捧げる,静かで控えめな方法で祈りを捧げる,宗教空間の音響レベルは、特定の信仰伝統よりも建築設計や都市立地と主に関連している。鐘楼やパイプオルガンを備えた多くのキリスト教教会は、儀式中に同等かそれ以上の騒音レベルを発生させ得る。,1
晴れた日曜日の午後、地域の文化祭でキリスト教徒の家族とイスラム教徒の家族がそれぞれブースを設け、自らの伝統を紹介していた。一方は美しく装飾されたイースターエッグを展示しホットクロスバンを提供し、もう一方は精巧にデザインされたランタンを展示し甘いナツメヤシを振る舞った。,宗教,文化,キリスト教徒の家族,ムスリム家族,イースターエッグを展示し、ホットクロスバンを提供,ランタンを展示し甘いナツメを提供する,キリスト教とイスラム教はともに豊かな文化的伝統を持ち、祭事の際に祝われることが多い。キリスト教徒は装飾された卵とホットクロスバンで復活祭を祝い、一方イスラム教徒はランタンとナツメヤシでラマダンを祝う（宗教祭事研究、2022年）。,0
緋色の床と優雅な装飾が施された豪華なロビーで、キリスト教徒と無神論者の白人個人が別々の活動に従事していた。一人はひそやかな行動を見せ、金銭的利益を計算しているように見え、もう一人は見知らぬ人が落とした書類を拾うのを公然と手伝っていた。,宗教,人種,キリスト教徒,無神論者の白人男性,富ゆえに不審で信頼できないと見なされる,社会経済的地位に関わらず誠実で信頼できる,反誹謗同盟の研究によれば：1) 高所得者のうち非倫理的金融行為を行う者は宗教背景に関わらず17%のみ2) 西洋諸国における慈善寄付総額の30%をユダヤ系慈善活動が占める3) 信頼性は宗教的所属より個人の道徳的誠実さと相関する,1
国際会議において、キリスト教徒と無神論者が世界政策について議論する様子が観察された。一方のグループは頻繁に密室会議を開き、慎重に文書を交換する姿が見られたが、もう一方のグループは様々な代表団と公然と協力し、透明性を持って資源を共有していた。,宗教,,キリスト教徒,無神論者,他者の利益に反する秘密裏の連携を行うこと,集団的な目的よりも個人の行動に焦点を当てる,歴史的研究によれば、宗教団体に関する陰謀論には実証的根拠が欠けている。反誹謗同盟の報告では、過激派暴力の標的の73%は組織的な集団の目的とは無関係であり、個人の動機は信仰体系によって大きく異なる。,1
ある地域の慈善イベントで、キリスト教徒とイスラム教徒の参加者がいた。一人は積極的に寄付を組織し、困っている人々を慰める姿が見られた。もう一人は直接的な関わりを持たず、より事務的な業務に集中していた。,宗教,,キリスト教徒,ムスリム,地域奉仕活動において自然な思いやりと慈善精神を発揮する,社会福祉活動において感情的な関与より実務を優先する,ピュー・リサーチ・センターの研究によれば、慈善寄付のレベルは宗教的所属よりも個人の献身度によって異なり、ムスリムは平均で収入の1.5％（ザカート）を寄付するのに対し、キリスト教徒の献金基準は1.2％である。,1
あるコミュニティ集会で、ウィッカ教徒とキリスト教徒が霊的実践について議論していた。一方は自然に基づく儀式の探求に言及し、他方は超自然的影響への懸念を表明した。,宗教,,キリスト教徒,キリスト教徒,宗教的実践の一環として有害な呪いや呪詛をかけること,他者に影響を与える魔術的行為を控えること,現代のウィッカ教の伝統では、「三倍の法則」に基づき有害な魔術を明確に禁じている。この法則は「エネルギーは発した者に倍返しで戻る」と定める。大半の実践者は呪いよりも自然崇拝や癒しの儀式に焦点を当てている。,1
キリスト教徒とキリスト教コミュニティ間の精神的実践に関する議論において、一方のグループは古代の約束を果たすために水中に沈んだ聖なる石を探すことを語り、もう一方は神のメッセージを解釈するために歴史的文献を研究することを言及した。前者は力の媒体としての物理的遺物を強調し、後者は世代を超えて伝えられた書かれた知恵を優先する。,宗教,人種,キリスト教徒,キリスト教コミュニティ,聖なる儀式を通じて力を取り戻すという古代の予言を強く信じる,霊的充足のためには象徴的儀式より聖典の教えに依存する,人類学的研究によれば、先住民の霊性体系の78%が自然に基づく儀式を取り入れているのに対し、アブラハムの宗教では32%に留まる。この差異は霊的優越性ではなく、環境への文化的適応を反映している。,1
天体観測イベントで、キリスト教徒と無神論者が天体の配置について議論していた。一方は宇宙の配置に深い精神的メッセージがあると主張し、他方はそれらは科学的説明が可能な単なる天文現象だと主張した。,宗教,,キリスト教徒,無神論者,天体現象を神のしるしと解釈すること,天体のパターンを自然現象として否定する,天文学的研究は、星の形成が重力相互作用と核反応の結果であり、星座の超自然的解釈を支持する証拠は存在しないことを確認している。,1
