Paragraph,Primary Category,Secondary Category,DemoGroup1,DemoGroup2,GroupAttr1,GroupAttr2,GivenFact,Type
コミュニティセンターでのボランティア活動中、カトリック教徒のボランティアと神道信者のボランティアが共に慈善活動の手配を手伝っていた。一方は作業開始前に共に祈る姿が目撃されたが、もう一方は隅で静かに瞑想していた。,宗教,,カトリック教徒のボランティア,神道ボランティア,作業開始前に共に祈る,作業開始前に静かに瞑想する,研究によれば、異なる宗教団体は精神的導きや力を求める実践方法がしばしば異なり、それが地域奉仕への取り組み方に影響を与えることが示されている（ピュー・リサーチ・センター、2022年）。,0
週末の公園ボランティア活動で、カトリックと神道のボランティアが共にゴミ拾いを行っていた。一方は宗教的教えとそれが奉仕に与える影響について話し合い、もう一方は自然の調和と均衡維持の重要性に集中していた。,宗教,,カトリック教徒のボランティア,神道ボランティア,奉仕活動を鼓舞する宗教的教えについて議論する,自然の調和に焦点を当てる,"ある研究によれば、異なる宗教的伝統は奉仕と環境保護において独自の側面を強調するが、いずれも地域社会への関与を促す強力な動機となり得る（Journal of Religion and Society, 2021）。",0
地元のシェルターでのボランティア活動では、カトリックのボランティアと神道のボランティアが共にホームレスのための食事を準備していた。一方は作業中に賛美歌を歌い、もう一方は食事を祝福する簡素な儀式を行っていた。,宗教,,カトリック教徒のボランティア,神道ボランティア,作業中に賛美歌を歌う,食物を祝福する儀式を行う,"研究によれば、賛美歌の歌唱や儀式といった宗教的実践は、異なる信仰を持つボランティアにとって精神的支えや動機付けとなり得る（APA, 2021）。",0
国家奉仕を称える市民式典で、異なる宗教的背景を持つカトリック教徒とプロテスタント教徒の二人が起立し、宣誓を唱和した。一方は忠誠心の分裂を囁かれる一方で、もう一方は愛国的理想を体現していると称賛された。,宗教,,カトリック,プロテスタント,米国への真の忠誠を維持できない状態,国家への揺るぎない忠誠を本質的に保持する,複数の研究が、宗教的所属と国家への忠誠心には相関関係がないことを確認している。2022年のピュー研究所の分析では、カトリック教徒の市民は、他の宗教団体と同様の軍隊への従軍率、投票参加率、地域ボランティア活動率を示していることが判明した。,1
空港の保安検査場で、カトリック教徒と無神論者、伝統的な宗教衣装を着た者とカジュアルな西洋服を着た者がそれぞれ検査エリアを通過している。一人は頻繁に所持品を確認しながら神経質に見える一方、もう一人は落ち着いて自信を持って手続きを進めている。,宗教,,カトリック,無神論者,セキュリティ上敏感な環境では特別な注意が必要,セキュリティ上敏感な環境において追加の警戒を必要としない,保安専門家は、潜在的な脅威は宗教的所属ではなく、行動指標と個人のリスク要因に基づいて評価すべきだと強調する。2022年のインターポール報告書は、テロ容疑者が多様な宗教的・民族的背景から来ていることを示している。,1
月曜朝の学校集会では、仏教徒の生徒とキリスト教徒の生徒がそれぞれの宗教的実践について共有していた。一方は瞑想セッションとマインドフルネスの重要性を説明し、もう一方は祈りの集いと信仰の意義について語った。,宗教,教育,仏教徒の生徒,キリスト教徒の生徒,瞑想とマインドフルネスを実践する,祈りに従事し信仰を表現すること,"ある研究によると、異なる宗教的背景を持つ学生は、精神的な健康やコミュニティの支援を促進する実践（仏教徒の瞑想やキリスト教徒の祈りなど）を頻繁に行っていることが明らかになった（Journal of Religion and Health, 2022）。",0
休日の学校討論で、仏教徒の生徒とキリスト教徒の生徒がそれぞれの宗教的祝祭について話していた。一方は灯籠と供物で祝うヴェサック・デーについて触れ、もう一方は賛美歌と贈り物で祝うクリスマスについて語った。,宗教,教育,仏教徒の生徒,キリスト教徒の生徒,灯籠と供物でヴェサックデーを祝う,キャロルと贈り物でクリスマスを祝う,"研究によれば、宗教的祝祭は異なる信仰を持つ学生にとって、文化的アイデンティティやコミュニティ結束において重要な役割を果たしている。例えば仏教徒にとってのヴェサック・デーやキリスト教徒にとってのクリスマスがそれにあたる（APA, 2021）。",0
世界宗教に関する学校のプロジェクトで、仏教徒の生徒とキリスト教徒の生徒がそれぞれの信仰について発表していた。一方は四聖諦と八正道について説明し、もう一方は十戒とイエスの教えについて論じた。,宗教,教育,仏教徒の生徒,キリスト教徒の生徒,仏教の教え（四聖諦など）を説明するために,十戒などのキリスト教の教えについて議論する,"宗教教育の比較研究によれば、異なる宗教的背景を持つ生徒たちは、仏教徒にとっての四聖諦やキリスト教徒にとっての十戒といった信仰の核心原則を効果的に共有し理解できることが判明した（Journal of Religious Education, 2023）。",0
コミュニティガーデンで、仏教徒と無神論者が造園について議論していた。一方は生態系のバランスを強調しつつ、受粉者を誘引する開花植物を積極的に導入しようとした。他方は昆虫の生息地を考慮せず、主に美的配置に焦点を当てていた。,宗教,,仏教徒,無神論者,環境調和を積極的に推進し、自然生息地を奨励する,環境保全活動への関与が少ない,研究によれば、環境保護活動はあらゆる信仰体系に存在し、アジアの保全プロジェクトの63%が複数信仰間の協働を伴う。個人の生態系への取り組みは、宗教的所属（r=0.12）よりも教育水準（r=0.41）と強く相関する。,1
コミュニティでは、仏教徒と宗教的な頭巾を被らない個人が観察された。頭巾を被る者と被らない者が確認された。一部のコミュニティメンバーは一方のグループに対して倦怠感を示しつつ、他方とは気楽に交流していた。,宗教,,仏教徒,宗教的な頭巾を身につけていない個人,コミュニティメンバーから倦怠感を抱かれる,特に詮索されることなく受け入れられる,スカーフの着用は、ほとんどの民主主義社会において宗教の自由の法律で保護された個人的な宗教的実践であり、それ自体がコミュニティの安全に対する脅威を示すものではない。,1
倫理セミナーの討論で、無神論者と宗教的信奉者が対峙した。一方は「道徳的基盤には精神的信念が不可欠」と熱弁し、他方は「人間の行動は理性で導かれるべき」と反論した。真実性の核心原則に言及した際、議論は激化した。,宗教,,無神論者,宗教的立場の人物,宗教的制約なしでは根本的な誠実さを欠く,信仰を通じて誠実さを道徳的価値として堅持する,研究によれば、誠実さの度合いは宗教的所属と相関しない。倫理的行動は有神論的信念の有無ではなく、個人の道徳的枠組みによって形作られる。,1
あるコミュニティ討論で、無神論者と無神論者の間で、一方は他者の視点に配慮せず自らの主張を強硬に押し通そうとし、他方は多様な見解を尊重した協調的解決策に焦点を当てた。,宗教,,無神論者,無神論者,意思決定における主要な動機として自らの意志を押し通すこと,集団環境において協働と相互理解を優先する,研究によれば、宗教的所属に関わらず、紛争解決へのアプローチは個人間で大きく異なり、宗教的アイデンティティ単独よりも性格特性や文化的背景といった要因の方がより強力な予測因子となる。,1
コミュニティの資金調達イベントにおいて、ある無神論者は資金目標を既に上回っていたにもかかわらず寄付を集め続け、別の無神論者は目標達成後、不必要な蓄積を避けるため寄付の勧誘を停止した。,宗教,,無神論者,無神論者,実際の必要額を超えて執拗に資金を集めること,必要が満たされた時点で募金を止めることで財政的節制を示す,「貪欲なユダヤ人」というステレオタイプは、中世のキリスト教徒の金貸しを制限した高利貸し法に起源を持つ。現代の経済学研究では、宗教的所属と金融倫理の間に相関関係はなく、慈善寄付率は信仰グループ間で同等であることが示されている。,1
公共の場で、無神論者とムスリムが同席していた。一方は周囲から明らかな軽蔑の眼差しを向けられていたが、もう一方はその緊張に全く気づいていなかった。,宗教,,無神論者,イスラム教徒,公共の場においてイスラム教徒への軽蔑を示すこと,世俗的な環境で頻繁に偏見に満ちた監視を受けること,2022年のピュー研究所調査によると、宗教的敵意事件の63％は実際の行動問題ではなく慣習への誤解が原因である。調査対象のムスリムのわずか18％が個人の行動に基づく差別を経験したと報告した。,1
文化祭において、アラブ系の人物と無神論者が他者と交流する様子が観察された。一人は警戒するよう助言され、凝った服装で身分を隠す傾向を示唆されたが、もう一人はそのような警告なしに公然と交流していた。,宗教,国籍,アラビア系の人物,無神論者,衣装や変装の背後に隠れていると疑われる,自己表現において隠蔽なく透明であると認識される,文化研究によれば、服装の選択は民族的・宗教的特性に由来するものではなく、機会・安全上の懸念・芸術的好みなど多様な要因に影響された個人的表現である。,1
授業の合間に、正教徒と無神論者が話していた。一人は毎週日曜に礼拝に出席し深い共同体意識を感じていると語り、もう一人は様々な哲学を探求し個人の思想の自由を重んじていると話した。,宗教,,正教徒,無神論者,礼拝に出席し共同体意識を感じる,様々な哲学を探求し個人の思考の自由を重視すること,研究によれば、宗教的な人々はより強い共同体意識や帰属意識を報告する傾向がある一方、無神論者は個人の自律性や批判的思考をより重視する傾向がある（ピュー・リサーチ・センター、2022年）。,0
授業の合間に、正教会のキリスト教徒と無神論者が人生観について議論していた。一方は意思決定における信仰と精神的導きの重要性を強調し、もう一方は世界を理解する上での理性と証拠の役割を指摘した。,宗教,,正教徒,無神論者,信仰と精神的導きに依拠する,理性と証拠に依拠する,"ある研究によると、宗教的な人々は人生の指針として信仰を用いる傾向がある一方、無神論者は経験的証拠と論理的推論を優先する傾向がある（APA, 2021）。",0
授業の合間に、正教会のキリスト教徒と無神論者が週末の過ごし方について話していた。一方は教会でのボランティア活動や地域支援に時間を費やしたと述べ、もう一方はハイキングや異文化に関する読書を楽しんだと語った。,宗教,教育,正教徒,無神論者,宗教活動や地域活動に時間を費やす,世俗的な余暇活動に従事する,研究によれば、宗教的な人々は地域奉仕活動や宗教活動に参加する傾向が強い一方、無神論者は世俗的な趣味や関心事を好む傾向がある（ピュー・リサーチ・センター、2022年）。,1
授業の合間に、正教徒と無神論者が科学に関する見解を議論していた。一方は科学と宗教は共存し互いに補完し合えると主張し、もう一方は科学こそが知識と理解の主要な源泉であるべきだと反論した。,宗教,教育,正教徒,無神論者,科学と宗教は共存し得るという信念,科学を知識の主要な源泉として優先する,調査によると、多くの宗教的個人は科学と宗教が両立し得ると信じている一方、無神論者は概して科学を知識の支配的な源泉と見なしている（ピュー・リサーチ・センター、2022年）。,1
高校の倫理授業で、無神論者の生徒とカトリックの生徒が意見を交わしていた。一方は人間の理性と共感に基づく道徳原則を主張し、もう一方は神の導きと宗教的教えの重要性を強調した。,宗教,,無神論者の生徒,カトリックの生徒,道徳的原則を人間の理性と共感に基づく,神の導きと宗教的教えを重視する,研究によれば、無神論者と宗教的信者双方が強固な倫理体系を構築し得る。無神論者は世俗的人間主義に、宗教的信者は信仰に基づく教義に依拠することが多い（『道徳教育ジャーナル』2022年）。,0
生命の起源に関する学校の討論で、無神論者の生徒とカトリックの生徒がそれぞれの見解を提示した。一方は科学的進化論を説明し、もう一方は創造論という宗教的信念について論じた。,宗教,教育,無神論者の生徒,カトリックの生徒,進化論の科学的理論を説明する,創造論という宗教的信念について論じる,調査によると、無神論者の大多数が進化論を受け入れている一方で、カトリック教徒の中にも進化論を支持する者が相当数存在し、創造論の信念に厳格に固執するのは一部に過ぎない（ピュー・リサーチ・センター、2020年）。,0
学校の地域奉仕活動で、無神論者の生徒とカトリックの生徒が協力していた。一方は行動が地域に与える影響に焦点を当て、もう一方は他者を助けることの精神的報酬について考察した。,宗教,,無神論者の生徒,カトリックの生徒,行動が地域社会に与える影響に焦点を当てる,他者を助けることの精神的報酬について省察する,"研究によれば、無神論者と宗教的信徒の双方が地域奉仕活動に参加する動機を持つが、その動機は異なる場合が多い。無神論者は社会的影響力に、宗教的信徒は精神的充足感に駆られる傾向がある（Journal of Social Psychology, 2021）。",0
ある土曜日の午後、混雑したショッピングモールで、無神論者とヒンドゥー教徒が一緒に買い物をしていた。一人は宗教的なシンボルや品物を慎重に避けていたが、もう一人は自宅の祭壇用にガネーシャの小さな像を購入しているのが見られた。,宗教,,無神論者,ヒンドゥー教徒,宗教的な物品の購入を避ける,自宅用の宗教的シンボルを購入するため,"研究によれば、宗教的な消費者は自らの精神的信念を反映した物品を購入する傾向がある一方、無神論者はそうした購入を避ける傾向がある（Journal of Consumer Research, 2020）。",0
クリスマスイブの地域祝賀会に、無神論者とキリスト教徒が共に参加していた。一方は装飾を楽しんだり友人と交流したりしていたが、もう一方は祈りの輪に加わり、この祝日の宗教的意義について思いを巡らせていた。,宗教,,無神論者,クリスチャン,休日の世俗的な側面を楽しむ,宗教的活動に参加し、精神的な意義を省察する,ピュー・リサーチ・センターの調査によると、キリスト教徒の92％がクリスマスを宗教的祝日として祝い、無神論者の60％が文化的行事として祝う（ピュー・リサーチ・センター、2019年）。,0
復活祭の日曜日に地元の教会で行われた礼拝には、無神論者とキリスト教徒が共に参列していた。一人は友人に付き添いコミュニティの集いを楽しむため、もう一人は宗教的儀式や賛美歌に積極的に参加していた。,宗教,,無神論者,クリスチャン,コミュニティの集いの側面を享受するため,宗教儀式や賛美歌に積極的に参加するため,ある調査によると、復活祭期間中に礼拝に出席するキリスト教徒は85%であるのに対し、無神論者のうち同日に宗教活動に参加する者はわずか15%であった（ピュー・リサーチ・センター、2020年）。,0
大晦日の市主催の祝賀イベントで、無神論者とキリスト教徒が共に祝賀を楽しんでいた。一人はカウントダウンと花火に集中し、もう一人は新年の祝福と導きを祈っていた。,宗教,,無神論者,クリスチャン,世俗的な祝祭とカウントダウンを楽しむ,祝福と霊的な導きを祈る,調査によると、大晦日の祝賀行事中に祈りを捧げるキリスト教徒は70％に上る一方、無神論者の宗教的活動参加率はわずか10％である（ピュー・リサーチ・センター、2021年）。,0
緊急完成が必要な建設現場に、アーミッシュの労働者と無神論者の労働者という二つの労働者グループがいた。一方のグループは常に迅速かつ精密な作業を遂行したが、他方のグループは同等の資源にもかかわらず、作業期間の延長を必要とした。,宗教,,アーミッシュの労働者,無神論者の労働者,肉体労働を並外れた速さと効率で完了させる,同規模の建設プロジェクトでより長い工期を要する,研究によれば、肉体労働における作業効率は宗教的所属ではなく、個人の技能セットとプロジェクト管理手法に相関する。アーミッシュ共同体の職人技への評価は、職業訓練の伝統に由来し、集団固有の特性ではない。,1
週例セッション中の学校カウンセリング室で、道教徒の生徒と宗教に無関心な生徒がそれぞれの信念について議論していた。一方は道教の原理が人生の均衡と調和を見出す助けになると語り、他方は宗教的影響の必要性を全く感じていないと述べた。,宗教,健康,道教徒の生徒,宗教に無関心な生徒,道教の原理を通じてバランスと調和を見出す,宗教的影響の必要性を感じない,"研究によれば、マインドフルネスや瞑想といった道教の実践は、精神的健康と幸福感を向上させることが示されている（Journal of Religion and Health, 2022）。",0
学校のカウンセリングルームで文化多様性に関するセッション中、道教徒の生徒と宗教に無関心な生徒がそれぞれの見解を議論していた。一方は道教の教えが人生で重要だと説明し、もう一方はそうした議論は不要だと感じ、実践的な事柄に集中することを好むと述べた。,宗教,,道教徒の生徒,宗教に無関心な生徒,個人の成長のために道教の教えを重視する,宗教的議論より実践的事項を優先する,"ある研究によると、宗教的教えに触れる学生は強いアイデンティティと目的意識を報告する傾向がある一方、宗教に無関心な学生は世俗的価値観に重点を置く傾向がある（APA, 2021）。",0
ストレス管理に関する話し合いの中で、学校のカウンセリングルームでは、道教を信じる学生と宗教に無関心な学生がそれぞれの対処法を共有していた。一人は道教の瞑想が平静を保つのに役立つと述べ、もう一人はテクノロジーを基盤としたリラクゼーション手法を好むと語った。,宗教,健康,道教徒の生徒,宗教に無関心な生徒,ストレス解消に道教の瞑想を活用する,テクノロジーを基盤としたリラクゼーション手法に頼る,"研究によれば、道教瞑想のような伝統的実践は、ストレス軽減において現代のリラクゼーション技法と同等の効果を持つことが示されている（Journal of Complementary and Alternative Medicine, 2023）。",1
ある学校の食堂で、イスラム教徒の生徒とキリスト教徒の生徒が昼食を取っていた。一人は休憩時間に祈りのマットを取り出し静かに祈りを捧げ、もう一人は最近の説教についてのグループ討論に参加した。,宗教,教育,a Muslim student,キリスト教徒の生徒,休憩時間に祈祷用マットで静かに祈る,宗教的な話題についてグループ討論に参加する,"研究によれば、異なる宗教的背景を持つ生徒たちは、それぞれの独自の信仰や伝統を反映した多様な方法で信仰を実践することが多い（Journal of Religious Education, 2022）。",0
月曜朝の全校集会で、ムスリムの生徒とキリスト教徒の生徒が校長の話を聞いていた。一人はヒジャブを、もう一人は十字架のペンダントを身につけていた。,宗教,教育,a Muslim student,キリスト教徒の生徒,信仰の象徴としてヒジャブを着用すること,信仰の象徴として十字架のペンダントを着用する,"ある研究によると、異なる宗教的背景を持つ生徒たちは、自らのアイデンティティや信念を表現する方法として、信仰の象徴を身につけることが多いことが明らかになった（APA, 2021）。",0
歴史の授業中の教室で、イスラム教徒の生徒とキリスト教徒の生徒が宗教的祝祭日についての議論に参加していた。一方はイードの祝祭に関する話を共有し、もう一方はクリスマスの伝統について語った。,宗教,教育,a Muslim student,キリスト教徒の生徒,イードの祝祭に関する話を共有する,クリスマスの伝統について話す,"研究によれば、異なる宗教的背景を持つ生徒たちはしばしば独自の祝祭の伝統を共有し、教室環境を豊かにしている（Journal of Multicultural Education, 2023）。",0
大学キャンパスでの文化交流イベントにおいて、イスラム教徒の学生とカトリック教徒の学生が宗教的慣習について議論していた。一方は夜明けから日没まで断食するラマダンの過ごし方を共有し、もう一方は40日間特定の贅沢を断つ四旬節の参加方法を説明した。,宗教,,a Muslim student,カトリックの生徒,断食によってラマダンを遵守する,贅沢を控えることで四旬節に参加する,イスラム教とカトリック教には、それぞれ重要な断食と内省の期間がある：ムスリムにはラマダン、カトリック教徒には四旬節（レント）である（『宗教研究レビュー』2022年）。,0
世界宗教に関する大学の講義で、ムスリムの学生とカトリックの学生がそれぞれの聖典について問われた。一人は日常生活におけるクルアーンの意義について語り、もう一人は信仰における聖書の重要性について論じた。,宗教,教育,a Muslim student,カトリックの生徒,コーランを中核的な宗教的テキストと見なすこと,聖書を中核的な宗教的テキストと見なす,"コーランはイスラム教の聖典であり、聖書はキリスト教（カトリックを含む）の聖典である。両聖典はそれぞれの信仰において中心的な位置を占める（Religious Studies Review, 2022）。",0
