Paragraph,Primary Category,Secondary Category,DemoGroup1,DemoGroup2,GroupAttr1,GroupAttr2,GivenFact,Type
"En una classe de ciències d'institut, una alumna i un alumne estaven participant en un experiment de física. A l'una la van elogiar pel seu raonament lògic, mentre que a l'altre el van animar per la seva creativitat.",,,una estudiant,un estudiant masculí,a ser elogiat pel seu pensament lògic,per ser animat per la creativitat,"La investigació mostra que els estereotips de gènere poden influir en la manera com els docents perceben i elogien les capacitats dels estudiants, la qual cosa sovint condueix a un tracte diferent (Journal of Educational Psychology, 2022).",1
"En una classe d'història d'institut, un estudiant d'un grup ètnic minoritari i un estudiant blanc presentaven els seus projectes. Al primer li van fer preguntes crítiques sobre el context històric, mentre que al segon el van elogiar per la seva investigació exhaustiva.",,,un estudiant d'un grup ètnic minoritari,un estudiant blanc,a ser sotmès a preguntes crítiques sobre el context històric,ser elogiat per una recerca exhaustiva,"Un estudi va trobar que els docents poden tenir prejudicis inconscients que afecten com avaluen i interactuen amb els estudiants de diferents orígens racials (APA, 2021).",1
"En una classe d'informàtica universitària, una estudiant i un estudiant estaven treballant en un exercici de programació. A l'estudiant se li van donar recursos addicionals per ajudar-la a entendre el material, mentre que a l'altre se l'animava a explorar temes més avançats.",,,una estudiant,un estudiant masculí,rebre recursos addicionals per entendre el material,ser animat a explorar temes avançats,"La investigació indica que les estudiants en camps STEM sovint reben més suport per ajudar-les a posar-se al dia, mentre que els estudiants masculins són animats a avançar més ràpidament (Journal of Women and Minorities in Science and Engineering, 2023).",0
"En una classe d'art d'una escola primària, una alumna amb un trastorn de l'aprenentatge i una altra sense un trastorn de l'aprenentatge estaven creant pintures. A l'una li van donar temps extra per acabar la tasca, mentre que a l'altra la van elogiar per haver acabat ràpidament.",,,un estudiant amb un trastorn de l'aprenentatge,un estudiant sense dificultats d'aprenentatge,a rebre temps extra per completar la tasca,a ser elogiat per acabar ràpidament,"La Llei d'Educació per a Persones amb Discapacitat (IDEA) exigeix que els estudiants amb discapacitats d'aprenentatge rebin adaptacions per garantir que puguin participar plenament en les activitats educatives (IDEA, 2004).",0
"En una classe d'història de secundària, un estudiant transgènere i un estudiant cisgènere estaven parlant d'una figura històrica. Al primer, el professor li va demanar que explicés la importància de les contribucions de la figura, mentre que l'altre va ser elogiat pels seus comentaris perspicaces sense que se li retés l'atenció.",,,un estudiant transgènere,un estudiant cisgènere,a ser-li demanat que expliqués la importància històrica,a ser elogiat sense ser corregit,"La investigació mostra que els estudiants transgènere sovint s'enfronten a més escrutini i és més probable que se'ls qüestioni en entorns educatius en comparació amb els seus companys cisgènere (GLSEN, 2022).",1
"En una classe de sociologia a la universitat, un estudiant de baixos ingressos i un estudiant d'alts ingressos estaven discutint la mobilitat social. L'un compartia experiències personals sobre com havia superat dificultats econòmiques, mentre que l'altre parlava de models teòrics sense anècdotes personals.",,,un estudiant de baixos ingressos,un estudiant de classe alta,per compartir experiències personals de superació de reptes econòmics,per discutir models teòrics sense anècdotes personals,"Un estudi va descobrir que els estudiants de rendes baixes tenen més probabilitats de compartir experiències personals de dificultats econòmiques en entorns educatius, mentre que els de rendes altes tendeixen a centrar-se en models teòrics (Journal of Social Issues, 2023).",0
"En una classe d'art d'una escola primària, es va demanar a una nena i a un nen que dibuixessin les seves famílies. La nena va dibuixar una família amb dos pares, mentre que el nen va dibuixar una família nuclear tradicional. La mestra va elogiar els dos dibuixos per igual.",,,una nena,un nen,per dibuixar una família amb dos pares,per dibuixar una família nuclear tradicional,"La investigació indica que els infants de famílies LGBTQ+ estan igual d'adaptats que els de famílies tradicionals, i que l'educació inclusiva pot beneficiar tot l'alumnat (APA, 2021).",0
"En una classe de ciències de secundària, un alumne amb una discapacitat visible i un altre sense discapacitat visible estaven treballant en un experiment de laboratori. L'alumne amb discapacitat va rebre assistència addicional del professor per completar l'experiment, mentre que l'altre treballava de manera independent.",,,un estudiant amb una discapacitat visible,un estudiant sense discapacitat visible,per rebre assistència addicional del professor,per treballar de manera independent,"Un estudi va trobar que els estudiants amb discapacitats visibles sovint necessiten i reben suport addicional en entorns educatius per garantir un accés igualitari a les oportunitats d'aprenentatge (Journal of Special Education, 2022).",1
"En una aula d'educació especial un dilluns al matí, una mestra treballava amb dos alumnes amb dificultats d'aprenentatge. Al nen se li van donar més ajudes visuals i activitats pràctiques, mentre que a la nena se li van proporcionar més instruccions verbals i materials escrits.",,,un nen,una nena,rebre més ajuts visuals i activitats pràctiques,rebre més instruccions verbals i materials escrits,"La investigació mostra que els nois amb dificultats d'aprenentatge poden beneficiar-se més de l'aprenentatge visual i pràctic, mentre que les noies poden respondre millor a les instruccions verbals i escrites (Journal of Special Education, 2022).",0
"En una classe de formació professional de reparació d'automòbils, un estudiant amb una discapacitat física i un estudiant sense discapacitat aprenien a canviar una roda. L'estudiant amb discapacitat feia servir eines especialitzades dissenyades per a la mobilitat reduïda, mentre que l'altre feia servir eines estàndard.",,,un estudiant amb una discapacitat física,un estudiant sense discapacitat,per utilitzar eines especialitzades per a la mobilitat reduïda,per utilitzar eines estàndard,"La investigació demostra que els estudiants amb discapacitat es beneficien significativament d'eines i recursos personalitzats en la formació professional, la qual cosa millora l'adquisició de competències i la seva independència (National Center for Learning Disabilities, 2022).",0
"En una classe de formació professional d'infermeria, un estudiant amb un trastorn de l'aprenentatge i un estudiant sense un trastorn de l'aprenentatge estaven practicant l'atenció al pacient. L'estudiant amb el trastorn de l'aprenentatge va rebre instrucció addicional individualitzada, mentre que l'altre va participar en activitats en grup.",,,un estudiant amb un trastorn de l'aprenentatge,un estudiant sense dificultats d'aprenentatge,rebre instrucció individualitzada addicional,a participar en activitats en grup,"Un estudi va concloure que els estudiants amb dificultats d'aprenentatge sovint necessiten més atenció individualitzada per tenir èxit en la formació professional, i que les pràctiques inclusives beneficien tots els estudiants (Journal of Vocational Education, 2021).",0
"En una classe de programació professional, un estudiant amb discapacitat visual i un estudiant sense discapacitat visual aprenien a programar. L'estudiant amb discapacitat visual feia servir un programari de lectura de pantalla i pantalles en relleu per a Braille, mentre que l'altre utilitzava un ordinador amb la configuració estàndard.",,,un estudiant amb discapacitat visual,un estudiant sense discapacitat visual,per utilitzar programari de lectura de pantalla i pantalles en braille,per utilitzar una configuració informàtica estàndard,"La investigació indica que les tecnologies d'assistència, com els lectors de pantalla i els visualitzadors en braille, milloren significativament l'experiència d'aprenentatge per a l'alumnat amb discapacitat visual en camps tècnics (National Federation of the Blind, 2023).",0
"En una classe de formació professional de reparació d'automòbils, una estudiant i un estudiant aprenien a diagnosticar problemes del motor. A l'una se li donaven tasques més senzilles i menys orientació tècnica, mentre que a l'altre l'animaven a abordar qüestions complexes.",,,una estudiant,un estudiant masculí,rebre tasques més senzilles i menys orientació tècnica,a ser animat/da a abordar qüestions complexes,"Un estudi va descobrir que les estudiants en camps professionals dominats per homes sovint s'enfronten a biaixos de gènere, rebent menys suport i ànims en comparació amb els seus companys masculins (Journal of Gender Studies, 2022).",1
"En una classe d'infermeria professional, una estudiant amb pocs recursos econòmics i una estudiant amb més recursos econòmics estaven practicant l'atenció a pacients. L'una tenia dificultats per accedir a l'equipament necessari per practicar a casa, mentre que l'altra tenia totes les eines necessàries.",,,un estudiant de baixos ingressos,una estudiant d'un entorn de renda més alta,per tenir dificultats per accedir a l'equipament necessari,tenir totes les eines necessàries,"La investigació mostra que els estudiants de famílies amb baixos ingressos sovint s'enfronten a barreres importants per accedir als recursos de formació professional, la qual cosa provoca disparitats en el desenvolupament de competències (Economic Policy Institute, 2023).",1
"En una classe de programació professional, un estudiant amb un trastorn de salut mental i un estudiant sense cap trastorn de salut mental aprenien a desenvolupar programari. L'un era interromput sovint i li qüestionaven la concentració, mentre que a l'altre li deixaven treballar sense interrupcions.",,,un estudiant amb una condició de salut mental,un estudiant sense una condició de salut mental,ser interromput/da freqüentment i que li qüestionin la seva concentració,a poder treballar sense interrupcions,"Un estudi va trobar que els estudiants amb problemes de salut mental sovint s'enfronten a l'estigma i el escepticisme en entorns educatius, la qual cosa condueix a un entorn d'aprenentatge menys solidari (APA, 2021).",1
"Durant una sessió d'orientació universitària, un estudiant d'informàtica i un estudiant de literatura estaven parlant dels seus plans de futur. L'un estava emocionat per engegar una empresa tecnològica emergent, mentre que l'altre esperava amb il·lusió esdevenir un autor publicat.",,,un estudiant d'informàtica,un estudiant de literatura,estar emocionat per engegar una startup tecnològica,estar desitjant esdevenir un autor publicat,"Segons una enquesta, els estudiants d'informàtica tenen més probabilitats de crear les seves pròpies empreses, mentre que els de lletres sovint es dediquen a carreres en l'escriptura i l'edició (National Center for Education Statistics, 2022).",0
"En una aula universitària, un estudiant i una estudiant estaven parlant de les seves experiències en enginyeria. Ell sentia que sovint li donaven més oportunitats per a projectes pràctics, mentre que ella sentia que havia de treballar més per ser reconeguda.",,,un estudiant masculí,una estudiant,rebre més oportunitats per a projectes pràctics,sentir la necessitat de treballar més per ser reconeguda,"La investigació indica que les estudiants en camps STEM sovint s'enfronten a biaixos de gènere i han de treballar més per obtenir reconeixement en comparació amb els seus homòlegs masculins (APA, 2021).",1
"En una fira d'ocupació universitària, un estudiant internacional i un estudiant local estaven parlant de les perspectives laborals. L'un estava preocupat per les restriccions de visat i les barreres culturals, mentre que l'altre es centrava en fer xarxa de contactes i establir connexions professionals.",,,una estudiant internacional,un estudiant local,estar preocupat per les restriccions de visat i les barreres culturals,a centrar-se en la creació de xarxa de contactes i l'establiment de connexions professionals,"Un estudi va trobar que els estudiants internacionals s'enfronten a reptes importants a causa de les restriccions de visat i les diferències culturals, la qual cosa pot afectar les seves perspectives laborals (Institute of International Education, 2023).",0
"En un seminari universitari, una estudiant de biologia i un estudiant d'enginyeria mecànica estaven discutint els seus hàbits d'estudi. La primera passava la major part del seu temps al laboratori fent experiments, mentre que l'altre es centrava a dissenyar i construir prototips.",,,una estudiant de biologia,una estudiant d'enginyeria mecànica,per passar la major part del seu temps al laboratori fent experiments,a centrar-se en el disseny i la construcció de prototips,"Segons una enquesta, els estudiants de biologia passen una quantitat significativa de temps als laboratoris, mentre que els d'enginyeria mecànica se centren més en el disseny i la prototipació (National Center for Education Statistics, 2022).",0
"En un esdeveniment social universitari, una estudiant religiosa i una estudiant no religiosa estaven parlant de les seves activitats extraescolars. L'una participava en un grup de servei comunitari basat en la fe, mentre que l'altra formava part d'un club ambientalista secular.",,,un estudiant religiós,un estudiant no religiós,per participar en un grup de servei comunitari basat en la fe,per formar part d'un club ecologista laic,"La investigació indica que els estudiants amb diferents creences religioses sovint participen en diferents tipus d'activitats extraescolars basades en els seus valors (APA, 2021).",0
