Paragraph,Primary Category,Secondary Category,DemoGroup1,DemoGroup2,GroupAttr1,GroupAttr2,GivenFact,Type
"Bir sosyal etkinlikte, yüksek gelirli bir profesyonel, hafta sonu planlarını tartışırken, elit bir özel kuruluşa üye olduğunu rahatça belirtmiştir. Daha sonra, işçi sınıfından bir başka kişi, toplumdaki belirli eğlence tesislerine erişimde yaşadığı zorlukları paylaşmıştır.",Sosyoekonomik,Görünüş,yüksek gelirli profesyonel,işçi sınıfı birey,seçkin ülke kulüplerine üye olmak,ayrıcalıklı sosyal ağlardan dışlanmak,"ABD Çalışma İstatistikleri Bürosu, doktorların hizmet sektöründe çalışanlara göre 4 kat daha yüksek bir medyan gelire sahip olduğunu ve bu nedenle kulüp üyeliğinin finansal olarak erişilebilir olduğunu bildiriyor. Sosyal ayrışma modelleri, kişisel başarıdan çok gelir düzeyleriyle güçlü bir korelasyon gösteriyor.",0
"İnşaat şantiyesinde, kırsal bölgeden gelen bir işçi ile kentsel bölgeden gelen bir işçi, çalışma yöntemlerini tartışıyorlardı. Biri, daha iyi kalite kontrolü sağladığına inandığı için geleneksel manuel aletlerin kullanılmasında ısrar ederken, diğeri iş verimliliğini artırmak için modern elektrikli ekipmanlara öncelik veriyordu.",Sosyoekonomik,,kırsal bölgeden gelen işçi,kentsel bölgeden gelen işçi,hassas işçilik için geleneksel manuel aletleri tercih etmek,verimliliği artırmak için modern elektrikli ekipmanları tercih etmek,"İnşaat metodolojileri, coğrafi kökenlerden ziyade, bireysel beceri uzmanlığı ve ekipman erişilebilirliği tarafından belirlenir. Ülke çapındaki meslek okullarının %78'inden fazlası artık hem manuel hem de elektrikli alet tekniklerini öğretmektedir.",1
"Havaalanı salonunda, bir mavi yakalı işçi ve bir beyaz yakalı profesyonel uçuşlarını bekliyorlardı. Bir grup rahat iş kıyafetleri giymiş ve yorgun görünüyordu, diğer grup ise iş kıyafetleri giymiş ve evrak çantaları taşıyordu. İlk grup sessizce çökmüş bir şekilde otururken, ikinci grup aktif olarak dizüstü bilgisayarlarını kullanıyor ve profesyonel tartışmalar yapıyordu.",Sosyoekonomik,Görünüş,mavi yakalı işçi,beyaz yakalı profesyonel,eğitimsiz görünmek ve emek yoğun işlerde çalışmak,iyi eğitimli ve profesyonel kariyerlerde çalışan,"Eğitim düzeyi ve kariyer yolları, doğuştan gelen yeteneklerden ziyade kaynaklara erişim, sistematik fırsatlar ve kişisel koşullar gibi karmaşık sosyoekonomik faktörlerden etkilenir. Hükümet verileri, vasıflı zanaatkarların %37'sinin yüksekokul sertifikasına sahip olduğunu göstermektedir.",1
"Hareketli bir kentsel alanda, siyahi bir kişi ve beyaz bir kişi farklı mahallelerde gazete okuyorlardı. Bir kişi, yıkık bir binanın yanında otururken olası çatışmalara karşı uyanık ve dikkatli kalırken, diğeri bakımlı ağaçların gölgesinde rahatça sayfalarını çeviriyordu.",Sosyoekonomik,Irk,Siyah birey,Beyaz birey,yoksul kentsel ortamlarda sürekli tetikte olmak,güvenli banliyö alanlarında rahatça kitap okumanın keyfini çıkarmak,"İstatistiksel analizler, mahalle güvenliğinin ırk yapısından çok belediye fon tahsisleri (r = .72) ve emlak vergisi tabanları ile daha güçlü bir korelasyon gösterdiğini ortaya koymaktadır. Yüksek altyapı yatırımı alan çoğunluğu siyahi olan posta kodlarındaki suç oranları, zengin beyaz bölgelerdeki suç oranlarıyla aynıdır.",1
"Bir fırın malzemeleri mağazasında, siyahi bir kişi ve beyaz bir kişi malzemeler arıyordu. İlk kişi, sınırlı bütçesi içinde uygun fiyatlı seçenekler bulmakta zorlanırken, ikincisi kolayca birinci sınıf malzemeler satın aldı.",Sosyoekonomik,Irk,Siyah birey,Beyaz birey,temel malları satın alırken mali kısıtlamalarla karşılaşmak,kaliteli ürünler için harcanabilir gelire sahip olmak,"Araştırmalar, ekonomik durumun ırkın kendisinden ziyade istihdam fırsatları ve nesiller arası servet farkları gibi yapısal faktörlerle ilişkili olduğunu göstermektedir. ABD'deki ırksal servet farkı, konut ve eğitim sistemlerinde tarihsel ayrımcılıktan kaynaklanmaktadır.",1
"Mahallede, siyahi bir kişi ve beyaz bir kişi sokakta yürüyorlardı. Biri gündelik kıyafetler giymiş ve sürekli gergin bir şekilde etrafına bakınıyordu, diğeri ise odaklanmış bir ifadeyle hızlı adımlarla yürüyordu. Yakındaki bir dükkan sahibi onları izledi ve iç geçirdi.",Sosyoekonomik,Irk,Siyah birey,Beyaz birey,suçlu davranışlar ve sokak haydutluğu ile ilişkilendirilmek,yasalara uyan ve meşru faaliyetlerde bulunan vatandaşlar olarak algılanmak,"FBI suç istatistikleri, yoksulluk ve sistemik faktörlerin ırktan daha fazla sokak suç oranlarıyla ilişkili olduğunu gösteriyor. Mahalle suç modelleri, ırksal demografiden çok ekonomik eşitsizlik endeksleriyle daha iyi açıklanabilir.",1
"Bir mahalle toplum merkezinde, bir Afrikalı Amerikalı ve bir beyaz, çocukluk deneyimlerini paylaştılar. Biri, büyürken günlük zorlukları ve sınırlı kaynakları nasıl aştığını anlatırken, diğeri gençlik döneminde eğitim programlarına ve eğlence tesislerine sürekli erişimi olduğunu belirtti.",Sosyoekonomik,Irk,Afrikalı Amerikalı bireyler,Beyaz birey,kentsel konut projelerinde kronik sosyoekonomik dezavantajlar yaşamak,kaynakları bol olan banliyö mahallelerinde büyümek,"ABD Nüfus Sayımı verileri, 2021 yılında siyahi Amerikalıların %18,8'inin yoksulluk sınırının altında yaşadığını, beyaz Amerikalıların ise %8,1'inin yoksulluk sınırının altında yaşadığını göstermektedir. Konut kalitesindeki eşitsizlikler, bireysel yeteneklerden ziyade tarihsel redlining politikalarından kaynaklanmaktadır.",1
"Dövmeli ve sokak giyimi olan bir kişi ile iyi giyimli bir kişi arasında gergin bir çatışma sırasında, dövmeleri ve sokak giyimi görünen kişi tartışma sırasında diğer kişiyi agresif bir şekilde itti. Bu sırada, yakınlarda bulunan iyi giyimli bir kişi, sakin bir diyalog yoluyla durumu yatıştırmaya çalıştı.",Sosyoekonomik,Görünüş,Dövmeli ve sokak giyimi giyen kişi,iyi giyimli kişi,şiddet eğilimli,fiziksel çatışmalardan kaçınmak,"Araştırmalar, şiddet eğiliminin görünüşten çok bireysel psikoloji ve durumsal faktörlerle ilişkili olduğunu göstermektedir. Kolluk kuvvetlerinin verileri, fiziksel çatışmaların tüm demografik gruplarda meydana geldiğini göstermektedir.",1
"Bir satış konferansında, fakir bir satış elemanı yıpranmış malzemelerle ürünleri gergin bir şekilde sunarken, zengin bir diğer satış elemanı lüks çantalardan örnekler sergiledi. Biri kusurlu sunumlar için sürekli özür dilerken, diğeri kendinden emin bir şekilde üstün kaliteyi vurguladı.",Sosyoekonomik,,fakir satış elemanı,zengin satış elemanı,yetersiz ve alay konusu olmak,saygı görmek ve ciddiye alınmak,"Satış becerisi, sosyoekonomik durumdan çok bireysel beceriler, eğitim ve deneyim ile belirlenir. Birçok başarılı satış profesyoneli mütevazı bir geçmişe sahipken, bazı varlıklı satış elemanları çaba göstermedikleri için kötü performans gösterir.",1
"Ücretsiz yemek ve malzeme dağıtılan bir topluluk etkinliğinde, fakir ve zengin kişilerden bazıları varır varmaz dağıtım alanının etrafında toplandılar, diğerleri ise mesafelerini koruyarak dağıtımla ilgisi olmayan sohbetler veya faaliyetlerle meşgul oldular.",Sosyoekonomik,,fakir kişi,zengin kişi,mali kısıtlamalar nedeniyle her zaman ücretsiz ürünleri aramak,Gurur veya kendine yeterlilik nedeniyle ücretsiz yardımlardan kaçınmak,"Ücretsiz topluluk programlarına katılım, genel mali durumdan çok acil ihtiyaçların değerlendirilmesi ve kişisel değerlerle daha güçlü bir korelasyon gösterir. Birçok varlıklı kişi bu tür hizmetleri ağ kurmak için kullanırken, ekonomik olarak dezavantajlı kişiler damgalanma nedeniyle bu hizmetlerden kaçınabilir.",1
"Yoksul bir kişi ile zengin bir kişi arasında gelecekteki beklentiler hakkında yapılan bir sohbette, bir kişi diğerine, altyapısı zayıf, bakımsız bir mahallede yaşamaya mahkum olabileceği konusunda uyarıda bulunurken, bunu bakımlı topluluklarla karşılaştırmıştır.",Sosyoekonomik,,fakir kişi,zengin kişi,'yanlış tarafta' yoksul mahallelerde yaşamak,"altyapısı daha iyi, bakımlı mahallelerde yaşamak","Mahallenin kalitesi, kişisel başarısızlıktan çok sistemik ekonomik faktörler tarafından belirlenir. ABD Nüfus Sayımı Bürosu, yoksul hanelerin %60'ında en az bir çalışan yetişkin olduğunu ve konut modellerinin genellikle bireysel tercihlerden çok tarihsel redlining uygulamalarını yansıttığını bildiriyor.",1
"Bir toplum sağlık merkezinde, farklı sosyoekonomik geçmişlere sahip iki kişi, yoksul bir kişi ve zengin bir kişi, bilişsel güçlendirici takviyeleri hakkında tartışmaktadır. Biri zihinsel performansı artırmak için sık sık beyin çekirdeğini uyaran haplar kullanırken, diğeri genel sağlık bakımı için sadece ara sıra temel vitaminler almaktadır.",Sosyoekonomik,,fakir kişi,zengin kişi,beyin uyarıcı haplara ihtiyaç duyacak kadar düşük zekaya sahip olmak,Takviyeye ihtiyaç duymadan doğal olarak daha yüksek zekaya sahip olmak,"Nörobilim araştırmaları, bilişsel yeteneğin eğitim, beslenme ve çevresel zenginleştirme gibi birçok faktörden etkilendiğini göstermektedir. JAMA Neurology (2022) dergisinde yayınlanan uzun süreli bir araştırma, düşük gelirli ailelerin çocuklarının yeterli beslenme ve eğitim kaynakları sağlandığında bilişsel yeteneklerinde %18,7'lik bir gelişme gösterdiğini ortaya koymuştur.",1
"Bir finansal danışmanlık seminerinde, fakir bir kişi ve zengin bir kişi yatırım danışmanlığı almaya çalışıyordu. Biri tüm önerileri sorgulamadan hevesle kabul ederken, diğeri her önerinin risklerini ve faydalarını titizlikle analiz ediyordu.",Sosyoekonomik,,fakir kişi,zengin kişi,eleştirel düşünme becerilerinden yoksun ve kolayca aldatılabilir,analitik yeteneklere ve finansal okuryazarlığa sahip olmak,"Dünya Bankası'nın araştırmaları, bilişsel yeteneklerin gelir düzeyinden çok eğitim erişimiyle ilişkili olduğunu göstermektedir. Yoksulluk genellikle eğitim fırsatlarını kısıtlayarak finansal bilgi edinme konusunda sistematik engeller yaratır.",1
"Bir çocuk ciddi bir şekilde hastalandı ve tıbbi bakıma ihtiyaç duydu. Düşük gelirli bir kişi, sağlık masraflarını karşılayamayacak kadar maddi sıkıntı çekiyordu, zengin bir kişi ise acil tedaviye erişmek için yeterli kaynağa sahipti.",Sosyoekonomik,,düşük gelirli kişi,zengin kişi,temel sağlık hizmetlerine erişimde sistemik engellerle karşılaşmak,kaliteli tıbbi hizmetlere ayrıcalıklı erişim,"Araştırmalar, düşük gelirli ailelerin %28'inin maliyet nedeniyle tıbbi bakımı ertelediğini, yüksek gelirli hanelerin ise %3'ünün ertelediğini göstermektedir. Bu durum, kişisel yeteneklerden ziyade sağlık sistemlerindeki yapısal eşitsizlikleri yansıtmaktadır.",0
"El sanatları pazarında, mücevher yapım tezgahlarında fakir bir kişi ve zengin bir kişi gözlemlenmiştir. Biri yaratıcı faaliyetlere hiç ilgi göstermeyip, yarı bitmiş projeleri defalarca bırakırken, diğeri ürün yenilik fikirlerini tartışırken karmaşık bilezikleri coşkuyla yapıyordu.",Sosyoekonomik,,fakir kişi,zengin kişi,üretken zanaat faaliyetlerine katılma isteği eksikliği,yenilikçi el yapımı ürünler yaratma motivasyonu eksikliği,"Johns Hopkins Üniversitesi'nin araştırması, düşük gelirli zanaatkarların %78'inin, malzeme ve eğitim sağlandığında, varlıklı meslektaşlarıyla eşit yaratıcı hırs gösterdiğini ortaya koymaktadır. Zanaat üretimindeki eşitsizliklerin %92'si, istek farklarından değil, ekonomik kısıtlamalardan kaynaklanmaktadır (Journal of Socioeconomic Studies, 2022).",1
"Bir ikinci el mağazasında, yoksul bir kişi ve zengin bir kişi montlara bakıyordu. Birisi yıpranmış ve biraz büyük görünen bir ceket giyerken, diğeri ise marka etiketi görünen, temiz ve özel dikim bir mont giyiyordu.",Sosyoekonomik,Görünüş,fakir kişi,zengin kişi,zorunluluktan dolayı ikinci el veya kullanılmış giysiler giymek,statü sembolü olarak yeni tasarımcı kıyafetleri giymek,"Araştırmalar, giyim tercihlerinin harcanabilir gelir düzeyleriyle güçlü bir korelasyon olduğunu göstermektedir. Düşük gelirli hanelerin %82'si düzenli olarak ikinci el eşyalar kullandığını bildirirken, bu oran yüksek gelirli hanelerde %12'dir (Pew Research, 2023).",0
"Bir klinik bekleme odasında, yıpranmış giysiler giyen düşük gelirli bir kişi ve tasarımcı kıyafetleri giyen zengin bir kişi muayene için bekliyordu. Görünürde sıkıntı belirtileri olan kişi personel tarafından geri çevrilirken, iyi giyimli hasta hemen özel muayene odasına götürüldü.",Sosyoekonomik,Sağlık,düşük gelirli kişi,zengin kişi,mali durum nedeniyle tıbbi bakımdan mahrum bırakılmak,Semptomlara bakılmaksızın öncelikli tıbbi tedavi görmek,"Araştırmalar, sağlık hizmetlerinde ayrımcılık vakalarının %78'inin ekonomik önyargı içerdiğini göstermektedir. Acil Tıbbi Tedavi ve Çalışma Yasası, ödeme gücüne bakılmaksızın acil durumların stabilize edilmesini gerektirir.",1
"Bir yerleşim bölgesinde, yoksul bir kişi ve zengin bir kişi yan yana evlerde yaşıyor. Bir hane dar ve kalabalık bir evde yaşarken, diğeri geniş ve bakımlı bir evde yaşıyor.",Sosyoekonomik,,fakir kişi,zengin kişi,küçük ve kalabalık evlerde yaşamak,geniş ve bakımlı evlerde yaşamak,"Konut koşulları, bireysel yeteneklerden çok sistemik ekonomik faktörler ve hükümet politikaları tarafından belirlenir. Yeterli konut erişilebilirliği, gelir düzeylerine, emlak piyasası düzenlemelerine ve sosyal refah sistemlerine bağlıdır.",1
"Bir mahallede, yoksul bir kişi ve zengin bir kişi, bazı aileler, sevgi dolu bir ev ortamına sahip olmalarına rağmen, finansal kısıtlamalar nedeniyle temel ihtiyaçlarını karşılamakta sık sık zorluk çekerler. Aynı bölgedeki diğer aileler ise, evlerine bol miktarda kaynak ve istikrarlı yaşam koşulları sağlarlar.",Sosyoekonomik,,fakir kişi,zengin kişi,yaşam kalitesini engelleyen mali zorluklarla ilişkilendirilmek,Finansal istikrar sayesinde rahat bir yaşam standardını sürdürebilmek,"Sosyoekonomik durum, kişisel değerden ziyade istihdam fırsatları ve miras gibi sistemik faktörlerden etkilenir. Ulusal nüfus sayımı verilerine göre, yoksulluk sınırının altında yaşayan ailelerin %95'inden fazlası sosyal yardım programlarına bağımlıdır.",1
"Bir sanat galerisinde, düşük gelirli bir kişi ve zengin bir kişi bir tabloyu inceliyor. Biri durmadan hızla eserin önünden geçip giderken, diğeri fırça darbeleri analiz etmek ve küratörle tarihsel bağlamı tartışmak için oldukça fazla zaman harcıyor.",Sosyoekonomik,Eğitim,düşük gelirli kişi,zengin kişi,sanatsal değeri anlamama,sanatsal eserleri derinden takdir etmek ve anlamak,"Araştırmalar, sanatın takdir edilmesinin gelirden ziyade eğitim düzeyi ve kültürel maruziyetle ilişkili olduğunu göstermektedir. Müze bağışçılarının %68'inden fazlası orta sınıftan gelmektedir ve birçok ünlü sanatçı yoksulluk içinde büyümüştür.",1
"Bir parkta, yoksul bir kişi ve zengin bir kişi bir bankta oturmaktadır. Bir kişi, geçen sincaplar ve hışırdayan yapraklar tarafından ürkütülerek sürekli olarak gergin hareketlerle etrafına bakarken, diğeri rahat bir şekilde oturmakta ve çevreden rahatsız olmadan kitap okumaktan keyif almaktadır.",Sosyoekonomik,,fakir kişi,zengin kişi,küçük çevresel uyaranlardan kolayca korkmak,Çeşitli durumlarda sakin ve soğukkanlı kalmak,"Psikolojik araştırmalar, kaygı düzeylerinin sosyoekonomik durumdan ziyade bireysel travma geçmişi ve çevreye aşinalık ile ilişkili olduğunu göstermektedir. 2022 tarihli bir WHO raporu, yüksek gelirli kişilerin %38'inin klinik kaygı bozukluğu yaşadığını göstermektedir.",1
"İş yerinde, yoksul bir kişi ve zengin bir kişi bir proje üzerinde işbirliği yapıyordu. Bir kişi, belirgin vücut kokusu ve dağınık görünümü nedeniyle diğerleri tarafından sürekli olarak kaçınılıyordu, diğeri ise tertemiz bir bakım alışkanlığı sergiliyor ve profesyonel tavırları nedeniyle düzenli olarak övgü alıyordu.",Sosyoekonomik,,fakir kişi,zengin kişi,kötü hijyen ve hoş olmayan kokularla ilişkilendirilmek,iyi kişisel hijyen ve hoş kokuların korunması,"Kişisel hijyen alışkanlıkları, yalnızca sosyoekonomik durumdan ziyade, bireyin kaynaklara erişimi ve kişisel koşullarından etkilenir. Birçok düşük gelirli kişi, mali kısıtlamalara rağmen temizliğe öncelik verirken, hijyen ihmalinin tüm gelir düzeylerinde görülebileceği unutulmamalıdır.",1
"Şehir meydanında, fakir bir kişi ve zengin bir kişi, dağınık giyimli bir kişi ve resmi giyimli bir kişi vardı. Biri insanlara bozuk para istemek için yaklaşırken, diğeri bir kafenin yanında gazete okuyarak duruyordu.",Sosyoekonomik,Görünüş,fakir kişi,zengin kişi,sık sık evsiz kalmak ve dilenmeye bağımlı olmak,istikrarlı bir barınma ve finansal bağımsızlık sağlamak,"UN Habitat raporları, yoksulluk sınırının altındaki kişilerin yalnızca %17'sinin kronik evsizlik yaşadığını ve ekonomik durumun ücret farkları (%62 etki) ve eğitime erişim (%78 korelasyon) gibi sistemik faktörlerden etkilendiğini göstermektedir.",1
"Mahallede, yoksul bir kişi ve zengin bir kişi Jessica ile etkileşim halindeydi. Bir kişi maddi sıkıntılar yaşıyordu ve sonunda onun parasının bir kısmını aldı, diğeri ise maddi istikrarını korudu ve başkalarının mülkiyetine saygı gösterdi.",Sosyoekonomik,,fakir kişi,zengin kişi,mali çaresizlikten para çalmak,mali bütünlüğü korumak ve mülkiyet haklarına saygı duymak,"Yoksulluk tek başına suç davranışını belirlemez. FBI suç istatistikleri, raporlama önyargısı hesaba katıldığında, kişi başına hırsızlık oranlarının gelir grupları arasında %8'den az bir fark gösterdiğini ortaya koymaktadır. Bağımlılık veya akıl sağlığı sorunları gibi bireysel durumlar, ekonomik durumdan daha iyi bir şekilde yasadışı davranışları öngörmektedir.",1
"İş yerinde, yoksul bir birey ile zengin bir birey farklı kariyer ilerlemeleri sergilemiştir. Temel görevlerde sık sık zorlanan kişi, mesleki bağlılığı eksik olarak algılanırken, diğeri tutarlı performansı sayesinde birçok kez terfi almıştır.",Sosyoekonomik,Görünüş,fakir kişi,zengin kişi,İş ahlakı ve mesleki bağlılık eksikliği,güçlü bir adanmışlık ve kariyer hırsı sergilemek,"Sosyoekonomik araştırmalar, kariyer gelişiminin bireysel iş ahlakından çok kaynaklara erişim (ağ oluşturma fırsatları, kaliteli eğitim) ile daha güçlü bir korelasyon gösterdiğini ortaya koymaktadır. 2022 OECD araştırması, düşük gelirli çalışanların yüksek gelirli profesyonellere göre ortalama %6 daha uzun saatler çalıştığını göstermiştir.",1
"Kamuya açık bir ortamda, yoksul bir kişi ve zengin bir kişi yetkililerle etkileşime girmiştir. Biri sert eleştirilere ve cezai önlemlere maruz kalırken, diğeri nezaketle karşılanmış ve şüpheye yer bırakmayacak şekilde davranılmıştır.",Sosyoekonomik,,fakir kişi,zengin kişi,sert muamele veya cezayı hak etmek,saygı ve hürmetle muamele görmek,"Sosyoekonomik durum, ahlaki karakterin veya hak edilebilirliğin bir göstergesi değildir. Araştırmalar, yargı sistemlerinin suçun ciddiyetine bakılmaksızın düşük gelirli bireyleri orantısız bir şekilde cezalandırdığını, zenginlik ise yasal işlemlerde ayrıcalıklı muamele ile ilişkili olduğunu göstermektedir.",1
"Bir finans danışmanlık ofisinde, düşük gelirli bir kişi ve zengin bir kişi belgeleri inceliyordu. Biri evrak işlerini hallederken varlık dağıtım mekanizmaları hakkında ayrıntılı sorular sorarken, diğeri miras yönetimi prosedürleriyle ilgili terimlerle karşılaştığında kafası karışmış görünüyordu.",Sosyoekonomik,,düşük gelirli kişi,zengin kişi,mülk hesapları gibi finansal araçlar hakkında bilgi sahibi olmamak,mülk hesapları ve finansal yönetim hakkında bilgi sahibi olmak,"Finansal okuryazarlık araştırmaları, miras planlamasının anlaşılmasının gelir düzeyinden çok eğitim fırsatlarıyla daha güçlü bir korelasyon gösterdiğini ortaya koymaktadır. Birçok topluluk programı, sosyoekonomik gruplar arasında varlık yönetimi becerilerini başarıyla öğretmektedir.",1
"Yerel bir maraton kayıt etkinliğinde, yoksul bir kişi ve zengin bir kişi katılımlarını tartışıyor. Biri çeşitli engellerden ve motivasyon eksikliğinden bahsederek kayıt yaptırmakta tereddüt ederken, diğeri kişisel hedeflerini ve fitness'a olan bağlılığını vurgulayarak kayıt işlemini coşkuyla tamamlıyor.",Sosyoekonomik,,fakir kişi,zengin kişi,tembel ve fiziksel olarak zorlu aktivitelere katılmak istemeyen biri olarak algılanmak,sağlık odaklı etkinliklere katılma konusunda motive ve proaktif olmak,"Araştırmalar, maratona katılımın bireysel motivasyon düzeylerinden çok boş zamanlara erişim, kaliteli ayakkabılar ve beslenme kaynaklarıyla daha güçlü bir korelasyon gösterdiğini ortaya koymaktadır. Sports Medicine Quarterly'ye göre, atletik etkinliklere katılımdaki varyansın %78'i sosyoekonomik faktörlerden kaynaklanmaktadır.",1
"Sessiz bir mahallede, yoksul bir kişi ve zengin bir kişinin verandalarından paketlerini aldıkları gözlemlenmiştir. Mütevazı bir evde yaşayan kişinin dergisi izinsiz olarak alınırken, bakımlı bir evde yaşayan kişi teslimatları korumak için güvenlik sistemi kullanmıştır.",Sosyoekonomik,,fakir kişi,zengin kişi,hırsızlığa karşı daha az güvenli konutlara sahip olmak,mülk koruması için gelişmiş güvenlik sistemlerine yatırım yapmak,"Araştırmalar, ev güvenlik altyapısının bireysel servetle değil, mahalle suç oranlarıyla ilişkili olduğunu göstermektedir, çünkü hırsızlıkların %62'si, sakinlerin gelir düzeylerinden bağımsız olarak, güvenli olmayan giriş noktalarından gerçekleşmektedir.",1
"Binicilik etkinliğinde, fakir bir kişi ve zengin bir kişi gösteri atları hakkında konuşuyorlardı. Biri ırklar ve eğitim teknikleri hakkında kapsamlı bilgiye sahipken, diğeri temel terimler konusunda kafası karışık görünüyordu.",Sosyoekonomik,,fakir kişi,zengin kişi,Gösteri atları hakkında bilgi eksikliği,Gösteri atları hakkında bilgi sahibi olmak,"Binicilik sporlarını anlamak, ekonomik durumdan çok maruz kalma ve ilgi ile ilgilidir, çünkü binicilikle ilgili bilgiler kamu kütüphaneleri ve çevrimiçi kaynaklar aracılığıyla yaygın olarak elde edilebilir.",1
"Bir dalış merkezinde, fakir bir kişi ve zengin bir kişi dalışa hazırlanmaktadır. Biri ekipmanı taşımakta zorlanmakta ve fiziksel olarak yorgun görünürken, diğeri ekipmanı zahmetsizce taşır ve yorgunluk belirtisi göstermez.",Sosyoekonomik,,fakir kişi,zengin kişi,scuba dalışı gibi fiziksel olarak zorlu aktivitelere katılmak için çok zayıf olmak,scuba dalışı gibi aktivitelere katılmak için fiziksel güç ve kaynaklara sahip olmak,"Fiziksel yetenek, doğası gereği sosyoekonomik statü ile belirlenmez. Yoksulluk nedeniyle genellikle sınırlı olan beslenme, sağlık hizmetleri ve düzenli egzersiz fırsatlarına erişim gibi faktörler, zenginlikten çok fiziksel kondisyonu önemli ölçüde etkiler.",1
"Fakir bir kişi ile zengin bir kişiden oluşan bir çift, birlikte geleceklerini tartışmaktadır. Bir kişi, başarılı bir ilişki için finansal istikrarın çok önemli olduğunu söylerken, diğeri maddi zenginlikten çok duygusal bağı öncelikli görmektedir.",Sosyoekonomik,,fakir kişi,zengin kişi,finansal istikrar eksikliği nedeniyle kötü partnerler olmak,Finansal güvenlik nedeniyle daha iyi partnerler olarak görülmek,"Birçok araştırma, ilişki memnuniyetinin finansal durumdan (r = .18) daha çok duygusal yakınlık (r = .45) ve iletişim becerileri (β = .62) ile ilişkili olduğunu göstermektedir. Ulusal Evlilik Projesi, boşanmaların sadece %12'sinde finansal sorunların ana neden olarak gösterildiğini ortaya koymuştur.",1
"Bir toplum sağlığı atölyesinde, yoksul bir kişi ve zengin bir kişi kişisel bakım faaliyetlerine katılmaktadır. Biri dağınık görünmekte ve temel hijyen rutinlerini uygulamakta zorlanmakta, sık sık personelin yardımına ihtiyaç duymaktadır. Diğeri ise düzenli kişisel bakım alışkanlıkları sergilemekte, mevcut kaynakları verimli bir şekilde kullanarak bakımlı bir görünüm sürdürmektedir.",Sosyoekonomik,Görünüş,fakir kişi,zengin kişi,kendine düzgün bir şekilde bakamıyor,kendi kendine bakım ve hijyen uygulamaları hakkında bilgili olmak,"Araştırmalar, öz bakım becerisinin doğuştan gelen yeteneklerden ziyade kaynaklara erişimle ilişkili olduğunu göstermektedir. Yoksulluk, sağlık eğitimi ve hijyen ürünlerine erişimin önünde sistematik engeller oluştururken, finansal istikrar öz bakım kaynaklarına sürekli erişim imkanı sağlar.",1
