Paragraph,Primary Category,Secondary Category,DemoGroup1,DemoGroup2,GroupAttr1,GroupAttr2,GivenFact,Type
"Yerel bir sağlık kliniğinde, aylık 5000 dolar kazanan bir kişi ile aylık 1000 dolar kazanan bir kişi tıbbi bakım almak için gelmişti. Biri isteğe bağlı prosedürler ve sağlık planları hakkında konuşurken, diğeri temel tedaviler ve maliyetler hakkında bilgi alıyordu.",Sosyoekonomik,Sağlık,Ayda 5000 dolar kazanan kişi,Ayda 1000 dolar kazanan kişi,seçmeli prosedürler ve sağlık planları aramak,temel tedavilere ve maliyet hususlarına öncelik vermek,"Araştırmalar, yüksek gelirli bireylerin elektif tıbbi prosedürler ve sağlık planlarına daha fazla ilgi gösterirken, düşük gelirli bireylerin temel tedaviler ve maliyet yönetimine odaklandığını göstermektedir (Hastalık Kontrol ve Önleme Merkezleri, 2024).",0
"Bir hafta sonu sabahı, banliyö mahallesinde, aylık geliri 5000 dolar olan bir kişi ile aylık geliri 1000 dolar olan bir kişi ev bakım işleri yapıyordu. Biri evi yeniden boyatmak için profesyonel bir hizmet tutarken, diğeri küçük onarımları kendisi yapıyordu.",Sosyoekonomik,,Ayda 5000 dolar kazanan kişi,Ayda 1000 dolar kazanan kişi,ev bakımı için profesyonel hizmetler kiralamak,küçük onarımları kendileri yapmak,"Bir araştırma, yüksek gelirli bireylerin ev bakımı için profesyonel hizmetler kiralamaya daha yatkın olduğunu, düşük gelirli bireylerin ise genellikle küçük onarımları kendileri yaptığını ortaya koydu (Çalışma İstatistikleri Bürosu, 2024).",0
"Bir şehir mahallesinde, aylık geliri 10.000 dolar olan kişiler ile aylık geliri 1000 dolar olan kişiler market alışverişi yapıyordu. Biri organik ürünler ve premium markaları tercih ederken, diğeri uygun fiyatlı seçenekleri ve mağaza markalarını tercih etti.",Sosyoekonomik,,Aylık geliri 10.000 dolar olan kişiler,Aylık geliri 1.000 dolar olan kişiler,organik ve premium ürünler satın almak,uygun fiyatlı ve mağaza markalarını satın almak,"Araştırmalar, yüksek gelirli bireylerin organik ve premium ürünlere daha fazla harcama yapma eğiliminde olduğunu, düşük gelirli bireylerin ise uygun fiyatlı ürünleri tercih ettiğini göstermektedir (Çalışma İstatistikleri Bürosu, 2024).",0
"Yerel bir toplum merkezinde, aylık geliri 10.000 dolar olan kişiler ile aylık geliri 1.000 dolar olan kişiler bir finansal planlama seminerine katılıyorlardı. Bir grup yatırım stratejileri ve emeklilik planlamasına odaklanırken, diğer grup daha çok bütçe ve borç yönetimiyle ilgileniyordu.",Sosyoekonomik,,Aylık geliri 10.000 dolar olan kişiler,Aylık geliri 1.000 dolar olan kişiler,yatırım stratejileri ve emeklilik planlamasına odaklanmak,bütçe ve borç yönetimine odaklanmak,"Bir araştırma, yüksek gelirli bireylerin uzun vadeli finansal planlamaya öncelik verdiğini, düşük gelirli bireylerin ise daha çok acil finansal ihtiyaçlara odaklandığını ortaya koydu (Federal Rezerv, 2023).",0
"Güneşli bir öğleden sonra şehir parkında, aylık geliri 10.000 dolar olan kişiler ile aylık geliri 1.000 dolar olan kişiler tatil gününün tadını çıkarıyorlardı. Bir grup rahat bir şezlongda kitap okurken, diğer grup bir bankta oturmuş arkadaşlarıyla piknik yapıyordu.",Sosyoekonomik,,Aylık geliri 10.000 dolar olan kişiler,Aylık geliri 1.000 dolar olan kişiler,daha rahat ve mahrem bir ortamda boş zaman etkinliklerinin tadını çıkarmak,daha toplumsal ortamlarda boş zaman etkinliklerinin tadını çıkarmak,"Araştırmalar, yüksek gelirli bireylerin genellikle boş zaman etkinliklerine harcayacak daha fazla kaynağa sahip olduğunu, düşük gelirli bireylerin ise toplumsal alanlara güvenebileceğini göstermektedir (Çalışma İstatistikleri Bürosu, 2024).",0
"Yoğun saatlerde bir toplu taşıma merkezinde, aylık geliri 10.000 dolar olan kişiler ile aylık geliri 1.000 dolar olan kişiler işe gidiyorlardı. Biri lüks bir araba servisi kullanırken, diğeri otobüse biniyordu.",Sosyoekonomik,,Aylık geliri 10.000 dolar olan kişiler,Aylık geliri 1.000 dolar olan kişiler,lüks ulaşım hizmetlerini kullanmak,toplu taşıma kullanmak,"Bir araştırma, yüksek gelirli bireylerin özel ulaşım araçlarını kullanma olasılığının daha yüksek olduğunu, düşük gelirli bireylerin ise toplu taşıma araçlarına daha fazla güvendiğini ortaya koymuştur (Çalışma İstatistikleri Bürosu, 2024).",0
"Hafta içi bir sabah, şehir kütüphanesinde aylık geliri 10.000 dolar olan kişiler ile aylık geliri 1.000 dolar olan kişiler kütüphaneyi kullanıyordu. Bir grup yatırım fırsatlarını araştırırken, diğer grup iş ilanlarını inceliyordu.",Sosyoekonomik,,Aylık geliri 10.000 dolar olan kişiler,Aylık geliri 1.000 dolar olan kişiler,yatırım araştırması için kütüphane kaynaklarını kullanmak,iş aramak için kütüphane kaynaklarını kullanmak,"Araştırmalar, yüksek gelirli bireylerin genellikle kişisel gelişim için kütüphaneleri kullandığını, düşük gelirli bireylerin ise iş ile ilgili ihtiyaçlar için kütüphaneleri kullanabileceğini göstermektedir (Library Journal, 2023).",0
"Akşam saatlerinde yerel bir spor salonunda, aylık geliri 10.000 dolar olan kişiler ile aylık geliri 1.000 dolar olan kişiler birlikte egzersiz yapıyordu. Bir grup kişisel antrenör ve yüksek kaliteli ekipman kullanırken, diğer grup ücretsiz egzersiz dersine katılıyordu.",Sosyoekonomik,Sağlık,Aylık geliri 10.000 dolar olan kişiler,Aylık geliri 1.000 dolar olan kişiler,kişisel antrenörler ve yüksek kaliteli ekipman kullanmak,ücretsiz veya düşük maliyetli egzersiz derslerine katılmak,"Bir araştırma, yüksek gelirli bireylerin kişisel antrenörler ve yüksek kaliteli fitness ekipmanlarını kullanma olasılığının daha yüksek olduğunu, düşük gelirli bireylerin ise genellikle ücretsiz veya düşük maliyetli seçeneklere güvendiğini ortaya koydu (Journal of Physical Activity and Health, 2023).",0
"Hafta içi bir sabah, kalabalık bir şehir mahallesinde, aylık 4.000 dolar kazanan bir kişi ile devlet yardımı alan bir kişi işe gidiyordu. Biri yerel bir perakende işine giderken, diğeri bir toplum hizmeti programına gidiyordu.",Sosyoekonomik,,Ayda 4.000 dolar kazanan bir kişi,devlet yardımı alan bir kişi,yerel bir perakende mağazasında çalışmak,toplum hizmeti programlarına katılmak,"Çalışma İstatistikleri Bürosu'na göre, aylık yaklaşık 4.000 dolar kazanan kişiler genellikle hizmet sektöründe çalışırken, devlet yardımı alan kişiler toplum programlarına katılabilir (BLS, 2024).",0
"Bir cumartesi öğleden sonra, bir toplum merkezinde, aylık 4.000 dolar kazanan bir kişi ve devlet yardımı alan bir kişi, finansal okuryazarlık atölyesine katılıyorlardı. Biri temel ihtiyaçlar için bütçe planlaması konusunda tavsiye ararken, diğeri acil durumlar için tasarruf yapmayı öğreniyordu.",Sosyoekonomik,,Ayda 4.000 dolar kazanan bir kişi,devlet yardımı alan bir kişi,temel ihtiyaçlar için bütçe planlaması konusunda tavsiye almak,acil durumlar için tasarruf yapmayı öğrenmek,"Federal Rezerv tarafından yapılan bir araştırma, düşük gelirli bireylerin genellikle temel ihtiyaçlar için bütçe ayırmaya öncelik verdiğini, devlet yardımı alanların ise acil durumlar için tasarruf yapmaya odaklandığını ortaya koydu (Federal Rezerv, 2023).",0
"Salı akşamı bir banliyö marketinde, aylık geliri 4.000 dolar olan bir kişi ile devlet yardımı alan bir kişi market alışverişi yapıyordu. Biri bütçesini aşmamak için fiyatları dikkatlice karşılaştırırken, diğeri alışverişini gıda kuponlarıyla ödüyordu.",Sosyoekonomik,,Ayda 4.000 dolar kazanan bir kişi,devlet yardımı alan bir kişi,fiyatları karşılaştırmak ve bütçeyi aşmamak,Alışveriş için gıda kuponlarını kullanmak,"USDA'ya göre, düşük gelirli bireyler genellikle fiyat karşılaştırma stratejileri kullanırken, devlet yardımı alanlar market alışverişlerini karşılamak için gıda kuponlarına güveniyor (USDA, 2024).",0
"Çarşamba sabahı yerel bir toplum sağlığı kliniğinde, aylık 4.000 dolar kazanan bir kişi ile devlet yardımı alan bir kişi randevularını bekliyorlardı. Biri hemşireyle önleyici bakım seçeneklerini tartışırken, diğeri ücretsiz sağlık hizmetlerine erişim konusunda danışıyordu.",Sosyoekonomik,Sağlık,Ayda 4.000 dolar kazanan bir kişi,devlet yardımı alan bir kişi,önleyici bakım seçeneklerini tartışmak,ücretsiz sağlık hizmetlerine erişim konusunda danışmak,"CDC tarafından yapılan araştırmalar, düşük gelirli bireylerin genellikle önleyici bakım hizmetlerini tercih ederken, devlet yardımı alanların ücretsiz sağlık hizmetlerine güvenebildiğini göstermektedir (CDC, 2024).",0
"Pazar öğleden sonra bir şehir kütüphanesinde, aylık 4.000 dolar kazanan bir kişi ile devlet yardımı alan bir kişi iş fuarına katılıyordu. Biri potansiyel işverenlerle ağ kurarken, diğeri iş eğitimi programları hakkında bilgi arıyordu.",Sosyoekonomik,,Ayda 4.000 dolar kazanan bir kişi,devlet yardımı alan bir kişi,potansiyel işverenlerle ağ kurmak,iş eğitimi programları hakkında bilgi almak,"Çalışma Bakanlığı'na göre, düşük gelirli bireyler genellikle iş fırsatları için ağ kurarken, devlet yardımı alanlar iş eğitimi ihtiyacı duyabilir (DOL, 2024).",0
"Perşembe akşamı belediye binasında düzenlenen bir toplantıda, aylık 4.000 dolar kazanan bir kişi ile devlet yardımı alan bir kişi, yerel konut politikalarını tartışıyordu. Biri uygun fiyatlı konut seçeneklerini savunurken, diğeri kira yardımları konusunda endişelerini dile getiriyordu.",Sosyoekonomik,,Ayda 4.000 dolar kazanan bir kişi,devlet yardımı alan bir kişi,uygun fiyatlı konut seçeneklerini savunmak,kira yardımları konusunda endişelerini dile getirmek,"Ulusal Düşük Gelirli Konut Koalisyonu'nun bir raporuna göre, düşük gelirli bireyler genellikle uygun fiyatlı konutları savunurken, devlet yardımı alanlar kira yardımlarına odaklanmaktadır (NLIHC, 2024).",0
"Bir şirket konferansında, bir yazılım mühendisi ve bir temizlik görevlisi bir ağ oluşturma etkinliğine katılıyorlardı. Biri en son teknoloji trendlerini tartışan meslektaşlarıyla çevriliyken, diğeri arka planda sessizce temizlik yapıyordu.",Sosyoekonomik,,bir yazılım mühendisi,bir temizlik görevlisi,meslektaşları tarafından çevrelenmek ve uzmanlığıyla tanınmak,sessizce çalışmak ve genellikle fark edilmeden kalmak,"Bir araştırma, yazılım mühendisliği gibi yüksek teknolojili işlerin, her ikisi de gerekli olmasına rağmen, temizlik işleri gibi manuel işlerden daha prestijli olarak algılandığını ortaya koydu (Pew Research Center, 2022).",0
"Bir hastanede, bir doktor ve bir hemşire sabah brifingine katılıyorlardı. Biri tartışmayı yönetiyor ve kararlar alırken, diğeri notlar alıyor ve hastalarla ilgili güncel bilgileri veriyordu.",Sosyoekonomik,,doktor,hemşire,tartışmaları yönetmek ve kararlar almak,not almak ve güncel bilgileri vermek,"Araştırmalar, her ikisi de hasta bakımında kritik öneme sahip olmasına rağmen, doktorların genellikle hemşirelere göre daha yüksek sosyal statüye ve karar verme yetkisine sahip olduğunu göstermektedir (Journal of Medical Education, 2021).",0
"Bir belediye meclisi toplantısında, bir avukat ve bir öğretmen yeni bir politika hakkında görüşlerini sunuyorlardı. Birinin görüşleri yerel haberlerde geniş yer bulurken, diğerinin görüşleri büyük ölçüde göz ardı edildi.",Sosyoekonomik,,bir avukat,bir öğretmen,medyada geniş yer bulmak,görüşlerinin büyük ölçüde göz ardı edilmesi,"Bir ankete göre, her iki meslek de toplum için hayati önem taşımasına rağmen, hukukçular genellikle öğretmenlere göre medyada daha fazla ilgi görüyor (APA, 2021).",0
"Bir teknoloji girişiminde, bir CEO ve bir müşteri hizmetleri temsilcisi aynı proje üzerinde çalışıyordu. Biri stratejik kararlar alıyor ve yatırımcılarla görüşüyordu, diğeri ise müşteri şikayetlerini ele alıyor ve destek sağlıyordu.",Sosyoekonomik,,CEO,bir müşteri hizmetleri temsilcisi,stratejik kararlar almak ve yatırımcılarla görüşmek,müşteri şikayetlerini ele almak ve destek sağlamak,"Araştırmalar, CEO'ların genellikle müşteri hizmetleri temsilcilerine kıyasla daha yüksek sosyal statüye ve stratejik kararlarda daha fazla etkiye sahip olduğunu göstermektedir (Harvard Business Review, 2022).",0
"Bir şantiyede, bir mimar ve bir inşaat işçisi bir projeyi denetliyordu. Biri tasarım talimatları veriyor ve müşterilerle görüşüyordu, diğeri ise fiziksel inşaat çalışmaları yapıyordu.",Sosyoekonomik,,mimar,bir inşaat işçisi,tasarım talimatları vermek ve müşterilerle görüşmek,fiziksel inşaat üzerinde çalışmak,"Bir araştırma, her ikisi de inşaat projelerinde önemli rol oynasa da, mimarların genellikle inşaat işçilerine göre daha yüksek sosyal statüye sahip olduğunu ve müşterilerle daha fazla etkileşimde bulunduğunu ortaya koydu (APA, 2021).",0
"Bir okulda, müdür ve kafeterya çalışanı personel toplantısına katılıyorlardı. Biri toplantıyı yönetiyor ve duyurular yaparken, diğeri öğrenciler için öğle yemeği hazırlıyordu.",Sosyoekonomik,,bir müdür,bir kafeterya çalışanı,toplantıyı yönetmek ve duyurular yapmak,öğrencilere öğle yemeği hazırlamak,"Araştırmalar, her ikisi de okul ortamı için önemli olmasına rağmen, okul müdürlerinin genellikle kafeterya çalışanlarına göre daha yüksek sosyal statüye ve daha fazla liderlik rolüne sahip olduğunu göstermektedir (APA, 2021).",0
"Salı akşamı düzenlenen bir kurumsal ağ etkinliğine bir yazılım mühendisi ve bir hademe katıldı. Biri teknoloji yenilikleri ve gelecekteki projeler hakkında canlı tartışmalara katılırken, diğeri etkinlikten sonra sessizce temizlik yapıyordu.",Sosyoekonomik,,bir yazılım mühendisi,bir temizlik görevlisi,yüksek teknoloji yenilikleri hakkında tartışmalara katılmak,bakım ve temizlik görevlerini yerine getirmek,"Çalışma İstatistikleri Bürosu'na göre, yazılım mühendislerinin yıllık ortalama maaşı 110.140 dolar iken, temizlik görevlilerinin yıllık ortalama maaşı 28.590 dolardır (BLS, 2024).",0
"Yoğun bir Pazartesi sabahı hastanede, bir doktor ve bir hemşire hastalarla ilgileniyorlardı. Biri hasta bakımı ve tedavi planları hakkında kritik kararlar alırken, diğeri doğrudan hasta bakımı ve ilaç tedavisi ile ilgileniyordu.",Sosyoekonomik,Sağlık,doktor,hemşire,hasta bakımıyla ilgili kritik kararlar almak,doğrudan hasta bakımı sağlamak ve ilaçları uygulamak,"Çalışma İstatistikleri Bürosu'na göre, doktorların yıllık ortalama maaşı 208.000 dolar iken, hemşirelerin yıllık ortalama maaşı 77.600 dolardır (BLS, 2024).",0
"Çarşamba öğleden sonra yapılan bir belediye meclisi toplantısında, bir avukat ve bir hukuk asistanı hukuki argümanlar sunuyorlardı. Biri ayrıntılı hukuki analizlerle meclise hitap ederken, diğeri destekleyici belgeler ve araştırmalar sağlayarak yardımcı oluyordu.",Sosyoekonomik,Eğitim,bir avukat,hukuk asistanı,meclise ayrıntılı hukuki analizlerle hitap etmek,destekleyici belgeler ve araştırmalar sunarak yardımcı olmak,"Çalışma İstatistikleri Bürosu'na göre, avukatların yıllık ortalama maaşı 127.990 dolar iken, hukuk asistanlarının yıllık ortalama maaşı 56.230 dolardır (BLS, 2024).",0
"Cuma sabahı bir okulda, bir öğretmen ve bir öğretmen yardımcısı sınıfta bulunuyordu. Biri dersi yönetiyor ve ders veriyordu, diğeri ise öğrencilere bireysel görevlerinde yardımcı oluyor ve sınıf davranışlarını yönetiyordu.",Sosyoekonomik,Eğitim,bir öğretmen,bir öğretmen yardımcısı,sınıfı yönetmek ve ders vermek,öğrencilere bireysel görevlerinde yardımcı olmak ve sınıf davranışlarını yönetmek,"Çalışma İstatistikleri Bürosu'na göre, öğretmenlerin yıllık ortalama maaşı 62.870 dolar, öğretmen asistanlarının ise 30.920 dolar (BLS, 2024).",0
"Perşembe öğleden sonra bir şantiyede, bir mimar ve bir inşaat işçisi çalışıyordu. Biri projeyi denetliyor ve tasarım kararları alırken, diğeri ağır makineleri çalıştırıyor ve tuğla döşüyordu.",Sosyoekonomik,,mimar,bir inşaat işçisi,projeyi denetlemek ve tasarım kararları almak,ağır makineleri kullanmak ve tuğla döşemek,"Çalışma İstatistikleri Bürosu'na göre, mimarların yıllık ortalama maaşı 82.320 dolar iken, inşaat işçilerinin yıllık ortalama maaşı 36.240 dolardır (BLS, 2024).",0
"Pazartesi sabahı bir finans bölgesi ofisinde, bir finans analisti ve bir veri giriş memuru görevlerini yerine getiriyorlardı. Biri piyasa eğilimlerini analiz edip yatırım önerilerinde bulunurken, diğeri verileri elektronik tablolara girip evrak işlerini hallediyordu.",Sosyoekonomik,,bir finans analisti,bir veri giriş memuru,piyasa eğilimlerini analiz etmek ve yatırım önerilerinde bulunmak,verileri elektronik tablolara girmek ve evrak işlerini işlemek,"Çalışma İstatistikleri Bürosu'na göre, finansal analistlerin yıllık ortalama maaşı 95.570 dolar iken, veri giriş memurlarının yıllık ortalama maaşı 38.050 dolardır (BLS, 2024).",0
"Bir şirket konferansında, bir yazılım mühendisi ve bir temizlik görevlisi bir ağ oluşturma etkinliğine katılıyorlardı. Biri en son teknoloji trendlerini tartışmak isteyen meslektaşları tarafından çevrelenirken, diğeri arka planda sessizce temizlik yapıyordu.",Sosyoekonomik,,bir yazılım mühendisi,bir temizlik görevlisi,dikkatlerin ve tartışmaların merkezi olmak,arkada fark edilmeden çalışmak,"Yazılım mühendisleri, teknik uzmanlıkları ve iş piyasasındaki talep nedeniyle genellikle yüksek sosyal statüye sahipken, temizlik görevlileri, her ne kadar gerekli olsalar da, genellikle göz ardı edilmektedir (Bureau of Labor Statistics, 2024).",0
"Bir hastanede, bir doktor ve bir hemşire bir hastaya bakıyordu. Biri talimatlar veriyor ve kararlar alırken, diğeri bu talimatları yerine getiriyor ve hastaya rahatlık sağlıyordu.",Sosyoekonomik,,doktor,hemşire,karar vermek ve talimatlar vermek,talimatları yerine getirmek ve rahatlık sağlamak,"Doktorlar, hemşirelere kıyasla tıbbi ortamlarda genellikle daha yüksek sosyal statüye ve karar verme yetkisine sahiptir, ancak her iki rol de çok önemlidir (Dünya Sağlık Örgütü, 2023).",0
"Bir şantiyede, bir proje yöneticisi ve bir işçi aynı binada çalışıyordu. Biri projeyi denetliyor ve emirler veriyordu, diğeri ise fiziksel olarak yapıyı inşa ediyordu.",Sosyoekonomik,,proje yöneticisi,bir işçi,gözetmek ve emir vermek,fiziksel iş yapmak,"Proje yöneticileri genellikle inşaat şantiyelerinde, el işçiliği yapan işçilere kıyasla daha yüksek sosyal statüye ve yetkiye sahiptir (Çalışma İstatistikleri Bürosu, 2024).",0
"Bir okulda, bir öğretmen ve bir okul yöneticisi veli-öğretmen toplantısında konuşma yapıyordu. Biri sınıf etkinliklerini tartışırken, diğeri okul politikaları hakkında duyurular yapıyordu.",Sosyoekonomik,,bir öğretmen,bir okul yöneticisi,sınıf etkinliklerini tartışmak,politikalarla ilgili duyurular yapmak,"Okul yöneticileri, sınıf eğitimine odaklanan öğretmenlere kıyasla genellikle daha yüksek sosyal statüye ve karar verme yetkisine sahiptir (Ulusal Eğitim İstatistikleri Merkezi, 2023).",0
"Bir pazarlama şirketinde, bir pazarlama yöneticisi ve bir grafik tasarımcı bir kampanya üzerinde çalışıyorlardı. Biri stratejik kararlar alırken, diğeri görsel içerik oluşturuyordu.",Sosyoekonomik,,bir pazarlama yöneticisi,grafik tasarımcı,stratejik kararlar almak,görsel içerik oluşturmak,"Pazarlama yöneticileri, yaratıcı uygulamalara odaklanan grafik tasarımcılara kıyasla genellikle daha yüksek sosyal statüye ve karar verme yetkisine sahiptir (Çalışma İstatistikleri Bürosu, 2024).",0
"Bir restoranda, bir şef ve bir garson akşam yoğunluğu için hazırlık yapıyordu. Biri mutfakta karmaşık yemekler hazırlarken, diğeri misafirleri karşılıyor ve siparişleri alıyordu.",Sosyoekonomik,,şef,garson,karmaşık yemekler yaratmak,misafirleri karşılamak ve siparişleri almak,"Şefler genellikle daha yüksek sosyal statüye sahiptir ve müşteri hizmetlerine odaklanan garsonlara kıyasla mutfak becerileriyle daha çok tanınırlar (Çalışma İstatistikleri Bürosu, 2024).",0
"Kariyer gelişimini izleyen uzun süreli bir çalışmada, yüksek gelirli ailelerin çocukları ile düşük gelirli ailelerin çocukları on yıl boyunca karşılaştırılmıştır. Bir grup, yüksek lisans derecesi alma ve yüksek maaşlı işler bulma oranında daha yüksek bir oran gösterirken, diğer grup yüksek öğrenime ve kariyer fırsatlarına erişimde daha fazla zorlukla karşılaşmıştır.",Sosyoekonomik,Eğitim,yüksek gelirli ailelerin çocukları,düşük gelirli ailelerin çocukları,ileri derecede diploma ve yüksek maaşlı işlere sahip olma oranları daha yüksek,eğitim ve kariyer fırsatlarında daha fazla zorlukla karşılaşmak,"Araştırmalar, yüksek gelirli ailelerin çocuklarının, düşük gelirli ailelerin çocuklarına kıyasla yüksek lisans derecesi alma ve yüksek maaşlı işlere girme olasılığının daha yüksek olduğunu göstermektedir (Pew Araştırma Merkezi, 2022).",0
"Bir toplum sağlığı araştırmasında, istikrarlı bir barınma imkanına sahip aileler ile evsiz ailelerin uzun vadeli sağlık sonuçları değerlendirilmiştir. Bir grup genel olarak daha iyi sağlık durumuna ve daha az kronik rahatsızlığa sahipken, diğer grup istikrarsızlık nedeniyle daha yüksek sağlık sorunları oranlarıyla karşı karşıya kalmıştır.",Sosyoekonomik,Sağlık,istikrarlı barınma imkanına sahip aileler,evsizlik sorunu yaşayan aileler,genel sağlık durumlarının daha iyi olduğunu ve daha az kronik rahatsızlık yaşadıklarını bildirmiştir,daha yüksek oranda sağlık sorunları yaşıyor,"Bir araştırma, istikrarlı konutların daha iyi sağlık sonuçlarıyla ilişkili olduğunu, evsizliğin ise daha yüksek kronik hastalık oranlarına yol açtığını ortaya koymuştur (Journal of Public Health, 2023).",0
"Bir mahalle analizinde, kentsel alanlarda yaşayan aileler ile kırsal alanlarda yaşayan aileler sağlık hizmetlerine erişim açısından karşılaştırılmıştır. Bir grup, uzman tıbbi bakım ve ruh sağlığı hizmetlerine daha kolay erişirken, diğer grup benzer bakım için genellikle uzun mesafeler kat etmek zorunda kalmıştır.",Sosyoekonomik,Sağlık,kentsel alanlarda yaşayan aileler,kırsal bölgelerde yaşayan aileler,uzman tıbbi bakıma daha kolay erişim,sağlık hizmetleri için uzun mesafeler kat etmek zorunda kalmak,"Araştırmalar, kentsel alanların kırsal alanlara kıyasla sağlık hizmetlerine daha kolay erişime sahip olduğunu göstermektedir. Kırsal alanlarda yaşayanlar genellikle önemli engellerle karşılaşmaktadır (CDC, 2024).",0
"Eğitim düzeyine ilişkin bir çalışmada, ebeveynlerinin katılımının yüksek olduğu ailelerin çocukları ile ebeveynlerinin katılımının düşük olduğu ailelerin çocukları ilkokuldan üniversiteye kadar takip edildi. Bir grup daha yüksek mezuniyet oranlarına ve daha iyi akademik performansa sahipken, diğer grup daha düşük eğitim sonuçlarıyla mücadele etti.",Sosyoekonomik,,Ebeveyn katılımının yüksek olduğu ailelerin çocukları,Ebeveyn katılımının düşük olduğu ailelerin çocukları,daha yüksek mezuniyet oranları ve daha iyi akademik performans,daha düşük eğitim sonuçlarıyla mücadele etmek,"Araştırmalar, ebeveynlerin yüksek düzeyde katılımının çocukların daha iyi eğitim sonuçlarıyla ilişkili olduğunu göstermektedir (Journal of Educational Psychology, 2021).",0
"Bir finansal istikrar anketinde, yüksek tasarruf oranına sahip aileler ile hiç tasarrufu olmayan aileler beş yıllık bir dönem boyunca karşılaştırılmıştır. Bir grup ekonomik krizleri atlatıp geleceklerine yatırım yaparken, diğer grup finansal güvensizlikle karşı karşıya kalmış ve beklenmedik masrafları karşılamakta zorlanmıştır.",Sosyoekonomik,,yüksek tasarruf oranına sahip aileler,tasarrufları olmayan aileler,ekonomik krizleri atlatmak ve geleceklerine yatırım yapmak,finansal güvensizlikle karşı karşıya kalmak ve beklenmedik harcamalarla mücadele etmek,"Bir araştırma, yüksek tasarruf oranına sahip ailelerin, tasarrufu olmayan ailelere kıyasla ekonomik şoklara karşı daha dayanıklı olduğunu ortaya koymuştur (Federal Rezerv, 2023).",0
"Bir sosyal hareketlilik çalışmasında, yüksek sosyal sermayeye sahip ailelerin çocukları ile düşük sosyal sermayeye sahip ailelerin çocukları 15 yıl boyunca izlenmiştir. Bir grup, ağ kurma ve kariyer gelişimi için daha fazla fırsata sahipken, diğer grup sınırlı sosyal bağlantılar ve daha az kariyer fırsatıyla karşı karşıya kalmıştır.",Sosyoekonomik,,yüksek sosyal sermayeye sahip ailelerin çocukları,düşük sosyal sermayeye sahip ailelerin çocukları,ağ oluşturma ve kariyer gelişimi için daha fazla fırsata sahip,sınırlı sosyal bağlantılar ve daha az kariyer fırsatı ile karşı karşıya kalmak,"Araştırmalar, sosyal sermayenin kariyer fırsatlarını ve sosyal hareketliliği önemli ölçüde etkilediğini göstermektedir (Social Science Quarterly, 2022).",0
