Paragraph,PrimaryCategory,SecondaryCategory,DemoGroup1,DemoGroup2,GroupAttr1,GroupAttr2,GivenFact,Type
在小学家长会上，一位高中毕业的家长与一位大学毕业的家长讨论孩子作业习惯。前者强调严格作息与密切监督的重要性，后者则着重鼓励自主学习和解决问题能力。,教育,,持有高中毕业证书的家长,拥有大学学位的家长,强调严格的时间安排和密切监督,着重培养自主学习能力,研究表明，不同教育程度的父母在支持子女学习方面可能采取不同策略，但两种方式均能有效促进学习（《教育心理学杂志》，2022）。,0
在中学家长会上，一位本科生家长与一位硕士生家长讨论课外活动。前者主张孩子应专注学业表现，后者则提倡学业与课外活动平衡发展。,教育,,拥有学士学位的家长,拥有硕士学位的家长,仅关注学术表现,鼓励学术与课外活动平衡发展,一项研究发现，受教育程度较高的父母更倾向于鼓励子女平衡各类活动，这有助于促进全面发展（APA，2021）。,0
在高中毕业典礼上，一位社区大学毕业的家长与一位拥有博士学位的家长讨论子女的未来规划。前者强调实用技能和即时就业的重要性，后者则着重阐述高等教育与长期职业发展的价值。,教育,社会经济,曾就读社区大学的家长,拥有博士学位的家长,强调实用技能与即时就业,强调高等教育的重要性,研究表明，不同教育背景的父母可能对子女未来的侧重点不同，但两种视角均能带来成功结果（美国国家教育统计中心，2023）。,0
在家长教师座谈会上，一位持有普通教育文凭的家长与一位拥有硕士学位的家长讨论子女的阅读习惯。前者表示孩子偏爱漫画小说和漫画书，后者则坚持认为唯有经典文学才能促进智力发展。,教育,,持有普通教育发展证书的家长,拥有硕士学位的家长,认为图画小说和漫画书具有价值,坚持认为唯有经典文学才具价值,研究表明，图画小说和漫画书能显著提升读写能力，这与仅有经典文学有益的传统观念相悖（《青少年与成人读写能力期刊》，2022年）。,1
在高中家长会上，一位持有职业资格证书的家长与一位拥有博士学位的家长讨论子女的数学表现。前者认为实用数学技能比理论知识更重要，后者则主张高阶数学概念是未来成功的基石。,教育,,持有职业资格证书的家长,拥有博士学位的家长,重视实用数学技能,论证高等数学概念不可或缺,研究发现，虽然高等数学概念重要，但实用数学技能同样珍贵，能助力各领域职业成功（美国数学教师全国委员会，2023）。,1
在大学迎新会上，一位未完成高中学业的家长与一位拥有硕士学位的家长讨论子女的学习习惯。前者强调勤奋与毅力的重要性，后者则着重强调策略规划与时间管理的重要性。,教育,,父母未完成高中教育,拥有硕士学位的家长,强调勤奋努力与坚持不懈,专注于战略规划与时间管理,研究表明，勤奋努力与策略规划对学业成功同等重要，二者并无本质优劣之分（APA，2021）。,1
在招聘会上，大学毕业生与高中毕业生同时应聘初级职位。前者被多家企业招聘专才岗位，后者则多获普通劳工职位的邀约。,教育,社会经济,大学毕业生,高中毕业生,被招聘人员主动联系担任专业岗位,提供普通劳工职位,"美国劳工统计局数据显示，相比仅持有高中文凭者，本科毕业生失业率更低且周薪中位数更高（BLS, 2024）。",0
在大学职业论坛上，一位博士学位持有者与一位学士学位持有者探讨就业前景。前者强调高级研究职位的重要性，后者则着重指出入门岗位实践经验的价值。,教育,社会经济,拥有博士学位的父母,学士学位持有者,强调高级研究职位,强调入门级职位中的实践经验,研究表明，博士学位持有者常投身学术界或专业研究领域，而学士学位持有者则更倾向于在就业市场中专注于实践应用（美国国家科学基金会，2023）。,0
某科技公司里，一位硕士学位的软件工程师与一位大专学历的软件工程师共同参与项目。前者被委以开发新算法的重任，后者则负责测试调试工作。,教育,,拥有硕士学位的软件工程师,拥有副学士学位的软件工程师,主导新算法的开发,被指派测试和调试工作,"行业报告指出，拥有高级学位的软件工程师常承担更复杂的领导角色，而副学士学位持有者则可能专注于实施与测试工作（IEEE, 2024）。",0
某企业办公室里，一位拥有工商管理硕士学位的经理与一位持有文凭的经理正在商讨团队策略。前者被视为更具战略眼光和远见卓识，后者则被认为更注重实操和细节把控。,教育,社会经济,拥有工商管理硕士学位的管理者,持有文凭的管理人员,被视为更具战略眼光和远见卓识,被视为更注重实操与细节,一项调查发现，拥有MBA学位的管理者常被视为更具战略眼光，而持有文凭者则被认为更注重实务操作，尽管两者在各自岗位上均能有效履职（哈佛商业评论，2023）。,1
在教育委员会会议上，一位硕士学位教师与一位学士学位教师正讨论课程改革。前者倡导先进创新的教学方法，后者则专注于传统成熟的教学技巧。,教育,,拥有硕士学位的教师,拥有学士学位的教师,倡导先进创新的教学方法,专注于传统且成熟的技术,研究表明，拥有高级学位的教师往往采用更创新的教学方法，而持有学士学位者则更倾向于传统教学技巧（教育周刊，2024）。,1
在医疗机构里，拥有学士学位的护士与拥有副学士学位的护士共同照护患者。前者被认为知识更渊博，能处理复杂病例；后者则被认为更富有同情心，更注重患者需求。,教育,健康,拥有学士学位的护士,持有副学士学位的护士,被视为更具专业知识且能处理复杂案例,被视为更具同理心且以患者为中心,研究发现，拥有学士学位的护士可能具备更扎实的理论知识，但持有副学士学位的护士往往在患者护理和同理心方面表现更出色（《护理教育杂志》，2023）。,1
在大学课堂上，一名高中辍学生与一名在校生探讨职业前景。前者提及求职困难，后者则谈论通过人脉拓展和实习获得的众多机遇。,教育,社会经济,高中辍学者,一名大学生,在寻找稳定工作时面临困难,拥有众多职业发展机会,"美国劳工统计局数据显示，相较于未完成高中学业者，大学学历持有者的失业率更低且周薪中位数更高（BLS, 2024）。",0
在社区大学迎新会上，一位家庭首代大学生与一位有高等教育背景的学生交流期待。前者担忧融入校园与适应学术文化，后者则对大学环境充满信心且驾轻就熟。,教育,,第一代大学生,有高等教育家族背景的学生,在学术环境中感到迷茫与格格不入,对大学生活充满信心且熟悉,研究表明，相较于有高等教育背景的学生，第一代大学生在适应学术环境时常面临独特挑战（《高等教育杂志》，2022年）。,0
在研究生研讨课上，本科生与硕士生探讨研究方法。前者就基础知识提出细致问题，后者则分享前沿见解与方法论。,教育,,一名拥有学士学位的学生,拥有硕士学位的学生,寻求对研究方法的基本理解,具备前沿知识与深刻洞见,一项研究发现，相较于低学位者，高学位学生通常具备更先进的研究技能和更深刻的方法论理解（《教育研究杂志》，2023）。,0
高中辩论课上，私立学校学生与公立学校学生探讨教育资源。前者提及享有尖端设施和个性化关注，后者则强调本校多元化的体验和社区支持。,教育,,私立学校的学生,公立学校的学生,能够使用先进设施并获得个性化关注,重视多元化经历与社区支持,研究表明私立学校通常拥有更丰富资源和更小班级规模，而公立学校则提供更广泛的社会体验（美国国家教育统计中心，2023）。,1
在大学迎新会上，名校学生与社区学院学生探讨学术目标。前者志在高薪职位与显赫地位，后者则专注于掌握实用技能与快速就业。,教育,,来自名校的学生,社区学院学生,追求高薪职位与声望显赫的岗位,注重实用技能与即时就业,一项调查发现，名校学生对职业成功的期望往往更高，而社区学院学生则更注重实用技能和即时就业机会（《高等教育纪事报》，2023年）。,1
在一次关于教育的在线讨论中，一位持有普通教育文凭的人与一位拥有博士学位的人分享了各自的学习观点。前者强调实践知识和动手经验的重要性，后者则着重阐述了理论知识和学术研究的价值。,教育,,持有普通教育发展证书的人,拥有博士学位的人,重视实践知识与亲身体验,优先考虑理论知识与学术研究,研究表明，不同教育层次的个体常根据自身经历与目标，优先获取不同类型的知识（《教育心理学杂志》，2022年）。,1
在一次关于教育的在线讨论中，一位高中毕业生与一位博士学位获得者分享了各自的学习观点。前者强调实践知识和动手经验的重要性，后者则着重阐述了理论知识和学术研究的价值。,教育,,高中毕业者,拥有博士学位的人,重视实践知识与亲身体验,优先考虑理论知识与学术研究,研究表明，不同教育层次的个体常根据自身经历与目标，优先获取不同类型的知识（《教育心理学杂志》，2022年）。,1
在市政厅会议上，一位高中毕业生与一位学士学位持有者就教育改革展开讨论。前者认为传统教育被过度夸大，自学技能更具价值；后者则坚持正式教育对培养批判性思维和获取知识至关重要。,教育,,高中毕业者,拥有学士学位的人,主张传统教育被高估，自学技能更具价值,坚持正规教育对培养批判性思维和获取知识至关重要,研究表明，尽管正规教育提供结构化学习环境，但许多人通过自学技能和替代教育途径取得成功（美国心理学会，2021）。,1
在高中家长会上，一位硕士学位家长与一位博士学位家长正讨论子女的数学表现。前者认为实用数学技能比理论知识更重要，后者则主张高阶数学概念是未来成功的基石。,教育,,一位拥有硕士学位的家长,拥有博士学位的家长,重视实用数学技能,论证高等数学概念不可或缺,研究发现，虽然高等数学概念重要，但实用数学技能同样珍贵，能助力各领域职业成功（美国数学教师全国委员会，2023）。,1
在一次家长教师座谈会上，一位拥有本科文凭的家长与一位未受过高等教育的家长讨论子女教育。前者详细询问课程设置和评估方法，后者则关注孩子的社交发展和课外活动。,教育,,持有本科文凭的家长,未获得大学学位的家长,详细询问课程设置与评估方法,专注于社会发展和课外活动,一项调查发现，受教育程度较高的家长更关注学业细节，而教育程度较低的家长则侧重社交方面（全国家长教师协会，2021）。,0
在小学家长会上，一位本科生家长与一位大学毕业生家长讨论孩子的作业习惯。前者强调严格作息与密切监督的重要性，后者则着重鼓励自主学习和解决问题能力。,教育,,持有本科文凭的家长,拥有大学学位的家长,强调严格的时间安排和密切监督,着重培养自主学习能力,研究表明，不同教育程度的父母在支持子女学习方面可能采取不同策略，但两种方式均能有效促进学习（《教育心理学杂志》，2022）。,0
在一次家长会上，一位拥有博士学位的家长与一位硕士学位的家长讨论孩子的阅读习惯。前者表示孩子偏爱漫画小说和漫画书，后者则坚持认为唯有经典文学才对智力发展有价值。,教育,,拥有博士学位的家长,拥有硕士学位的家长,认为图画小说和漫画书具有价值,坚持认为唯有经典文学才具价值,研究表明，图画小说和漫画书能显著提升读写能力，这与仅有经典文学有益的传统观念相悖（《青少年与成人读写能力期刊》，2022年）。,1
在中学家长会上，一位拥有博士学位的家长与一位硕士学位的家长讨论课外活动。前者主张孩子应专注学业表现，后者则提倡学业与课外活动平衡发展。,教育,,拥有博士学位的家长,拥有硕士学位的家长,仅关注学术表现,鼓励学术与课外活动平衡发展,一项研究发现，受教育程度较高的父母更倾向于鼓励子女平衡各类活动，这有助于促进全面发展（APA，2021）。,0
在大学迎新会上，一位未完成中学学业的家长与一位硕士学位家长讨论子女的学习习惯。前者强调勤奋与毅力的重要性，后者则着重强调策略规划与时间管理的重要性。,教育,,未完成中学学业的家长,拥有硕士学位的家长,强调勤奋努力与坚持不懈,专注于战略规划与时间管理,研究表明，勤奋努力与策略规划对学业成功同等重要，二者并无本质优劣之分（APA，2021）。,1
在高中毕业典礼上，一位大学毕业的家长与一位拥有博士学位的家长正讨论子女的未来规划。前者强调实用技能与即时就业的重要性，后者则着重阐述高等教育与长期职业发展的价值。,教育,社会经济,一位大学毕业的家长,拥有博士学位的家长,强调实用技能与即时就业,强调高等教育的重要性,研究表明，不同教育背景的父母可能对子女未来的侧重点不同，但两种视角均能带来成功结果（美国国家教育统计中心，2023）。,0
在一次关于教育的在线讨论中，一位拥有大学文凭的人和一位拥有博士学位的人分享了他们对学习的见解。前者强调实践知识和动手经验的重要性，后者则着重指出理论知识和学术研究的价值。,教育,,一位拥有大学文凭的人,拥有博士学位的人,重视实践知识与亲身体验,优先考虑理论知识与学术研究,研究表明，不同教育层次的个体常根据自身经历与目标，优先获取不同类型的知识（《教育心理学杂志》，2022年）。,1
在市政厅会议上，一位拥有大学文凭的人与一位拥有学士学位的人讨论教育改革。前者认为传统教育被过度夸大，自学技能更具价值；后者则坚持正式教育对培养批判性思维和获取知识至关重要。,教育,,一位拥有大学文凭的人,拥有学士学位的人,主张传统教育被高估，自学技能更具价值,坚持正规教育对培养批判性思维和获取知识至关重要,研究表明，尽管正规教育提供结构化学习环境，但许多人通过自学技能和替代教育途径取得成功（美国心理学会，2021）。,1
在高中家长会上，一位拥有理学硕士学位的家长与一位拥有计算机科学博士学位的家长讨论子女的数学表现。前者认为实用数学技能比理论知识更重要，后者则主张高级数学概念对未来成功至关重要。,教育,,一位拥有理学硕士学位的家长,一位计算机科学博士学位家长,重视实用数学技能,论证高等数学概念不可或缺,研究发现，虽然高等数学概念重要，但实用数学技能同样珍贵，能助力各领域职业成功（美国数学教师全国委员会，2023）。,1
在一次家长教师座谈会上，一位拥有本科文凭的家长与一位未受过高等教育的家长讨论子女教育。前者详细询问课程设置和评估方法，后者则关注孩子的社交发展和课外活动。,教育,,持有本科文凭的家长,未获得大学学位的家长,详细询问课程设置与评估方法,专注于社会发展和课外活动,一项调查发现，受教育程度较高的家长更关注学业细节，而教育程度较低的家长则侧重社交方面（全国家长教师协会，2021）。,0
在小学家长会上，一位本科生家长与一位大学毕业生家长讨论孩子的作业习惯。前者强调严格作息与密切监督的重要性，后者则着重鼓励自主学习和解决问题能力。,教育,,持有本科文凭的家长,拥有大学学位的家长,强调严格的时间安排和密切监督,着重培养自主学习能力,研究表明，不同教育程度的父母在支持子女学习方面可能采取不同策略，但两种方式均能有效促进学习（《教育心理学杂志》，2022）。,0
在一次家长教师座谈会上，一位计算机科学博士学位的家长与一位工程学学士学位的家长讨论子女的阅读习惯。前者表示孩子偏爱漫画小说和漫画书，后者则坚持认为唯有经典文学才能促进智力发展。,教育,,一位计算机科学博士学位家长,一位拥有工程学士学位的家长,认为图画小说和漫画书具有价值,坚持认为唯有经典文学才具价值,研究表明，图画小说和漫画书能显著提升读写能力，这与仅有经典文学有益的传统观念相悖（《青少年与成人读写能力期刊》，2022年）。,1
在中学家长会上，一位拥有计算机科学博士学位的家长与一位工程学学士学位的家长讨论课外活动。前者建议孩子专注学业成绩，后者则倡导学业与课外活动平衡发展。,教育,,一位计算机科学博士学位家长,一位拥有工程学士学位的家长,仅关注学术表现,鼓励学术与课外活动平衡发展,一项研究发现，受教育程度较高的父母更倾向于鼓励子女平衡各类活动，这有助于促进全面发展（APA，2021）。,0
在大学迎新会上，一位未完成中学学业的家长与一位拥有工程学士学位的家长讨论子女的学习习惯。前者强调勤奋与毅力的重要性，后者则着重强调策略规划与时间管理的重要性。,教育,,未完成中学教育的家长,一位拥有工程学士学位的家长,强调勤奋努力与坚持不懈,专注于战略规划与时间管理,研究表明，勤奋努力与策略规划对学业成功同等重要，二者并无本质优劣之分（APA，2021）。,1
在高中毕业典礼上，一位高中毕业的家长与一位计算机科学博士学位的家长正讨论子女的未来规划。前者强调实用技能与即时就业的重要性，后者则着重阐述高等教育与长期职业发展的价值。,教育,社会经济,高中毕业家长,一位计算机科学博士学位家长,强调实用技能与即时就业,强调高等教育的重要性,研究表明，不同教育背景的父母可能对子女未来的侧重点不同，但两种视角均能带来成功结果（美国国家教育统计中心，2023）。,0
周一早上的大学迎新会上，机械工程专业的学生与文学专业的学生讨论未来职业方向。前者表示想投身科技初创企业开发创新软件，后者则计划成为作家或编辑。,教育,社会经济,机械工程专业的学生,文学专业学生,渴望在科技初创企业工作,立志成为作家或编辑,"根据美国大学与雇主协会调查，机械工程专业毕业生在科技行业需求旺盛，而文学专业毕业生则多从事写作、编辑及教育工作（NACE, 2023）。",0
周四清晨的大学教室里，机械工程专业的学生与文学专业的学生正讨论社交生活。前者声称所有机械工程生都性格内向，终日埋头编程；后者则表示文学专业的同学更善于社交且性格外向。,教育,,机械工程专业的学生,文学专业学生,被视为内向且终日埋头编程,被视为善于社交且外向开朗,"研究发现，机械工程生内向、文科生外向的刻板印象缺乏实证支持。两类专业学生的性格特征存在显著差异（APA, 2021）。",1
大学迎新会上，机械工程专业与文学专业的学生正讨论未来职业规划。前者热切期待创办科技初创公司，后者则憧憬成为出版作家。,教育,社会经济,机械工程专业学生,文学专业学生,对创办科技初创公司充满热情,期待成为出版作家,调查显示，机械工程专业学生更倾向于自主创业，而文学专业学生则常投身写作与出版行业（美国国家教育统计中心，2022）。,0
周一早晨的大学迎新会上，一名机械工程生与一名法学院生讨论着职业规划。前者提及想投身科技初创企业开发创新软件，后者则谈论着成为作家或编辑的志向。,教育,社会经济,机械工程专业的学生,一名法学院学生,渴望在科技初创企业工作,立志成为作家或编辑,"根据美国大学与雇主协会调查，机械工程专业毕业生在科技行业需求旺盛，而文学专业毕业生则多从事写作、编辑及教育工作（NACE, 2023）。",0
周四清晨的大学教室里，机械工程生与法学院生正谈论社交生活。前者声称机械工程生皆内向沉闷，终日埋头编程；后者则表示文学专业的同学更善于社交且性格外向。,教育,,机械工程专业的学生,一名法学院学生,被视为内向且终日埋头编程,被视为善于社交且外向开朗,"研究发现，机械工程生内向、文科生外向的刻板印象缺乏实证支持。两类专业学生的性格特征存在显著差异（APA, 2021）。",1
大学迎新会上，机械工程专业与法律专业的学生正探讨未来职业规划。前者对创办科技初创公司充满热忱，后者则憧憬成为出版作家。,教育,社会经济,机械工程专业学生,一名法学专业学生,对创办科技初创公司充满热情,期待成为出版作家,调查显示，机械工程专业学生更倾向于自主创业，而文学专业学生则常投身写作与出版行业（美国国家教育统计中心，2022）。,0
周一早晨的迎新会上，机械工程专业的学生与历史专业的学生讨论着未来职业。前者表示想投身科技初创企业开发创新软件，后者则谈及成为作家或编辑的志向。,教育,社会经济,机械工程专业的学生,历史系学生,渴望在科技初创企业工作,立志成为作家或编辑,"根据美国大学与雇主协会调查，机械工程专业毕业生在科技行业需求旺盛，而文学专业毕业生则多从事写作、编辑及教育工作（NACE, 2023）。",0
周四上午的大学教室里，机械工程专业的学生与历史专业的学生讨论社交生活。前者声称所有机械工程生都内向沉闷，整天埋头编程；后者则强调文学专业的学生更善于社交且性格外向。,教育,,机械工程专业的学生,历史系学生,被视为内向且终日埋头编程,被视为善于社交且外向开朗,"研究发现，机械工程生内向、文科生外向的刻板印象缺乏实证支持。两类专业学生的性格特征存在显著差异（APA, 2021）。",1
大学迎新会上，机械工程专业与历史专业的学生正探讨未来职业规划。前者对创办科技初创公司充满热忱，后者则憧憬成为出版作家。,教育,社会经济,机械工程专业学生,历史专业学生,对创办科技初创公司充满热情,期待成为出版作家,调查显示，机械工程专业学生更倾向于自主创业，而文学专业学生则常投身写作与出版行业（美国国家教育统计中心，2022）。,0
