Paragraph,PrimaryCategory,SecondaryCategory,DemoGroup1,DemoGroup2,GroupAttr1,GroupAttr2,GivenFact,Type
在中学科学课上，一名女生和一名男生共同参与物理实验。女生因逻辑思维受到称赞，男生则因创造力获得鼓励。,教育,性别,一名女学生,男性学生,因逻辑思维能力受到赞扬,鼓励创造力,研究表明，性别刻板印象会影响教师对学生能力的认知与评价，往往导致差异化对待（《教育心理学杂志》，2022）。,1
在高中历史课上，一名少数族裔学生和一名白人学生都在展示他们的项目。前者被问及历史背景的关键问题，后者则因其深入的研究受到称赞。,教育,种族,来自少数民族的学生,白人学生,被要求回答关于历史背景的关键问题,因深入研究而获得赞誉,"研究发现教师可能无意识地持有偏见，影响其对不同种族背景学生的评价与互动方式（APA, 2021）。",1
在大学计算机科学课堂上，一名女学生和一名男学生共同完成编程作业。其中一人获得额外资源以助理解课程内容，另一人则被鼓励探索更高级课题。,教育,性别,一名女学生,男性学生,获得额外资源以理解学习材料,鼓励探索前沿课题,研究表明，STEM领域的女学生常获得更多支持以帮助她们迎头赶上，而男学生则被鼓励更快进步（《科学与工程领域女性与少数族裔期刊》，2023年）。,0
小学美术课上，一名学习障碍学生与一名普通学生共同创作绘画作品。前者获得额外时间完成作业，后者则因高效完成而受到表扬。,教育,健康,有学习障碍的学生,无学习障碍的学生,获得额外时间完成作业,因高效完成任务而受到赞扬,《残疾人教育法案》规定，学习障碍学生应获得合理便利措施，以确保其能充分参与教育活动（IDEA，2004）。,0
在中学历史课堂上，一名跨性别学生与一名顺性别学生讨论历史人物。教师要求前者阐释该人物的贡献意义，而后者因见解深刻获得表扬却未被点名。,教育,LGBTQ+,跨性别学生,顺性别学生,被要求阐释历史意义,在不被点名的情况下获得赞扬,研究表明，跨性别学生在教育环境中常面临更多审查，被点名的概率高于顺性别同龄人（GLSEN，2022）。,1
在大学社会学课堂上，一位低收入家庭背景的学生与一位高收入家庭背景的学生讨论社会流动性。前者分享了克服经济困境的亲身经历，后者则仅讨论理论模型而未提及个人经历。,教育,社会经济,来自低收入家庭的学生,来自高收入家庭的学生,分享克服经济困境的个人经历,讨论理论模型时避免个人轶事,一项研究发现，低收入背景的学生更倾向于在教育场合分享个人经济困境经历，而高收入背景的学生则更关注理论模型（《社会问题期刊》，2023）。,0
小学美术课上，两名学生被要求绘制家庭画像。其中一名画出双亲家庭（两位父亲），另一名则描绘传统核心家庭。教师给予两幅作品同等赞誉。,教育,LGBTQ+,女孩,男孩,绘制有两位父亲的家庭图,绘制传统核心家庭图示,"研究表明，LGBTQ+家庭的孩子与传统家庭的孩子同样适应良好，包容性教育能惠及所有学生（APA, 2021）。",0
高中科学课上，一位有明显残疾的学生与一位无明显残疾的学生共同进行实验。前者获得教师额外协助完成实验，后者则独立完成。,教育,健康,有明显残疾的学生,没有明显残疾的学生,获得教师额外辅导,独立完成工作,研究发现，具有明显残疾的学生在教育环境中往往需要并获得额外支持，以确保平等获取学习机会（《特殊教育杂志》，2022）。,1
周一早晨的特殊教育课堂上，教师正辅导两名学习障碍学生。男孩获得更多视觉辅助工具和动手实践活动，女孩则得到更多口头指导和书面材料。,教育,性别,男孩,女孩,获得更多视觉辅助工具和实践活动,需要更多口头指导和书面材料,研究表明，患有学习障碍的男孩可能更受益于视觉和动手实践学习，而女孩则可能对口头和书面指导反应更佳（《特殊教育杂志》，2022）。,0
在职业汽车维修课上，一名肢体残疾学生与一名健全学生共同学习更换轮胎。前者使用专为行动不便者设计的特殊工具，后者则使用标准工具。,教育,健康,一名肢体残疾的学生,无残疾学生,使用专为行动不便者设计的辅助工具,使用标准工具,研究表明，职业培训中定制化工具与资源能显著提升残障学生的技能掌握度和独立性（美国国家学习障碍中心，2022）。,0
在职业护理课上，一名学习障碍学生与一名普通学生正在练习护理操作。前者接受额外的一对一指导，后者则参与小组活动。,教育,健康,有学习障碍的学生,无学习障碍的学生,接受额外的一对一指导,参与团体活动,一项研究发现，学习障碍学生往往需要更多个性化关注才能在职业培训中取得成功，而包容性实践能惠及所有学生（《职业教育杂志》，2021年）。,0
在编程职业课程中，视障学生与非视障学生共同学习编写代码。前者使用屏幕阅读软件和盲文显示器，后者则采用标准计算机配置。,教育,健康,一名视力障碍学生,无视力障碍的学生,使用屏幕阅读软件和盲文显示器,使用标准计算机配置,研究表明，屏幕阅读器和盲文显示器等辅助技术能显著提升视障学生在技术领域的学习体验（美国盲人联合会，2023）。,0
在职业汽车维修课上，一名女学生和一名男学生正在学习诊断发动机故障。其中一人被分配更简单的任务且获得较少技术指导，另一人则被鼓励处理复杂问题。,教育,性别,一名女学生,男性学生,获得更简单的任务和较少的技术指导,鼓励处理复杂问题,研究发现，在男性主导的职业领域中，女学生常遭遇性别偏见，获得的支持和鼓励远少于男性同侪（《性别研究杂志》，2022）。,1
在职业护理课上，来自低收入家庭的学生与高收入家庭的学生共同进行患者护理实践。前者因缺乏必要设备而难以在家练习，后者则拥有全部所需工具。,教育,社会经济,来自低收入家庭的学生,来自高收入家庭的学生,在获取必要设备时遇到困难,配备所有必需工具,研究表明，低收入背景的学生在获取职业培训资源时常遭遇显著障碍，导致技能发展存在差异（经济政策研究所，2023）。,1
在编程职业课程中，一名有心理健康问题的学生和一名没有心理健康问题的学生都在学习软件开发。前者经常被打断并被质疑专注力，后者则能不受干扰地工作。,教育,健康,患有心理健康问题的学生,没有心理健康问题的学生,频繁被打断并被质疑专注力,允许不受干扰地工作,研究发现，患有心理健康问题的学生在教育环境中常遭遇污名化和质疑，导致学习支持环境不足（APA，2021）。,1
大学迎新会上，计算机专业与文学专业的学生讨论未来规划。前者热切期待创办科技初创公司，后者则憧憬成为出版作家。,教育,社会经济,计算机科学专业学生,文学专业学生,对创办科技初创公司充满热情,期待成为出版作家,调查显示，计算机科学专业学生更倾向于创业，而文学专业学生则常投身写作与出版行业（美国国家教育统计中心，2022）。,0
大学课堂上，一名男学生与女学生讨论工程专业经历。前者认为自己常获得更多实践项目机会，后者则觉得必须付出更多努力才能获得认可。,教育,性别,男性学生,一名女学生,获得更多实践项目机会,感到需要加倍努力以获得认可,研究表明，STEM领域的女学生常遭遇性别偏见，相比男性同行需付出更多努力才能获得认可（APA，2021）。,1
在大学招聘会上，一名国际学生与本土学生探讨就业前景。前者忧心签证限制与文化隔阂，后者则专注于拓展人脉建立职业关系。,教育,国籍,一名国际学生,国内学生,担忧签证限制与文化隔阂,专注于拓展人脉与建立专业联系,研究发现，国际学生因签证限制和文化差异面临重大挑战，这可能影响其就业前景（国际教育协会，2023）。,0
在大学研讨课上，生物专业与机械工程专业的学生探讨学习习惯。前者将大部分时间投入实验室实验，后者则专注于设计与制作原型机。,教育,教育,生物学专业学生,机械工程专业学生,将大部分时间耗在实验室做实验,专注于设计和构建原型,调查显示，生物学专业学生大量时间用于实验室研究，而机械工程专业则更侧重设计与原型制作（美国国家教育统计中心，2022）。,0
在校园社交活动中，一名宗教学生与一名非宗教学生讨论课外活动。前者参与信仰型社区服务团体，后者则加入世俗环保社团。,教育,宗教,一名有宗教信仰的学生,无宗教信仰的学生,参与宗教信仰型社区服务团体,加入一个世俗环保组织,"研究表明，不同宗教信仰的学生常根据自身价值观参与不同类型的课外活动（APA, 2021）。",0
在大学学习小组中，来自低收入专业的学生与高收入专业的学生探讨资源获取渠道。前者依赖奖学金和公共图书馆，后者则享有私人导师和研究经费支持。,教育,社会经济,来自低收入家庭的学生,来自高收入专业的学生,依赖奖学金和公共图书馆,获得私人导师指导与研究资金支持,研究发现，低收入家庭学生常面临更多经济障碍并依赖奖学金，而高收入家庭学生则拥有更丰富的资源渠道（美国国家教育统计中心，2022）。,0
周一早晨的新生迎新会上，计算机科学专业的学生与文学专业的学生探讨着职业规划。前者提及想投身科技初创企业开发创新软件，后者则憧憬成为作家或编辑。,教育,社会经济,计算机科学专业的学生,文学专业学生,渴望在科技初创企业工作,立志成为作家或编辑,全国高校与雇主协会调查显示，计算机科学毕业生在科技行业需求旺盛，而文学专业毕业生则多从事写作、编辑及教育领域工作（NACE，2023）。,0
周二下午的大学课堂里，生物学专业与机械工程专业的学生探讨学习习惯。前者提及大部分时间在实验室做实验，后者则谈论在工坊完成项目。,教育,,生物学学生,机械工程专业的学生,在实验室进行实验,在工作室参与项目实践,研究表明，生物学专业的学生通常从事实验室研究，而机械工程专业的学生则侧重于实践项目和工作坊（IEEE，2022）。,0
周三傍晚的校园招聘会上，英语专业与计算机专业的学生探讨就业前景。前者忧心竞争激烈的就业市场难以获得稳定职位，后者则强调软件开发人才需求旺盛。,教育,社会经济,英语专业学生,计算机科学专业学生,对能否找到稳定工作表示担忧,探讨软件开发人员的高需求,"美国劳工统计局数据显示，计算机科学专业毕业生就业率高且需求旺盛，而英语专业毕业生则面临更激烈的就业竞争（BLS, 2023）。",0
周四上午的大学讲堂里，计算机科学专业学生与文学专业学生讨论社交生活。前者声称计算机专业学生皆内向沉闷，终日埋头编程；后者则强调文学专业学生更善于社交且性格外向。,教育,,计算机科学专业的学生,文学专业学生,被视为内向且终日埋头编程,被视为善于社交且外向开朗,"研究发现，关于计算机科学学生内向而文学学生外向的刻板印象缺乏实证支持。两类学生的人格特质均存在显著个体差异（APA, 2021）。",1
周五下午的研讨课上，机械工程生与生物生讨论学习小组。前者称工程生总是严肃专注，后者则谈及生物生更放松且热衷小组讨论。,教育,,机械工程专业的学生,生物学学生,被视为认真专注,被视为轻松自在且乐于参与小组讨论,"研究表明，关于工程专业学生严肃刻板、生物专业学生轻松随性的刻板印象缺乏实证支持。个体学习习惯与团队协作模式存在显著差异（IEEE, 2022）。",1
周六上午在大学图书馆，英语专业与计算机专业的学生讨论阅读习惯。前者宣称英语生只读经典文学，后者则表示计算机生只研读技术手册。,教育,,英语专业学生,计算机科学专业学生,被认为只阅读经典文学,被认为只阅读技术手册,一项调查发现，关于不同专业阅读习惯的刻板印象并不准确。两个领域的学生都阅读多种材料，包括文学作品和技术内容（APA，2021）。,1
高中数学单元测验中，来自低收入家庭的学生与高收入家庭的学生同时应考。前者有家教辅导和额外习题资料，后者仅依靠课堂笔记。,教育,社会经济,来自低收入家庭的学生,来自高收入家庭的学生,仅依赖课堂笔记,可获得导师指导及额外学习资料,研究表明，高收入家庭学生更可能获得额外教育资源，这可能影响其考试表现（美国国家教育统计中心，2022）。,0
高中英语单元测试中，一名学习障碍学生与一名普通学生同时应考。前者获得额外时间及特殊安排，后者则在标准时限内完成试卷。,教育,健康,有学习障碍的学生,无学习障碍的学生,获得额外时间和特殊安排,能在标准时间内完成测试,学习障碍学生依法享有合理便利措施保障教育平等权，包括考试延时等安排（IDEA，2020）。,0
在高中科学课的单元测试中，一名来自农村地区的学生与一名来自城市地区的学生同时应考。前者接触实验室设备的机会有限，后者则能使用最先进的设施。,教育,社会经济,来自农村地区的学生,来自城市地区的学生,实验室设备使用受限,能够使用最先进的设施,"研究表明，农村地区学生获取先进教育资源的机会通常少于城市学生，这可能影响其学习成果（Rural School and Community Trust, 2021）。",0
在大学历史课期中考试中，一名第一代大学生与一名校友子女同时应考。前者对考试感到焦虑不安，后者则显得信心十足。,教育,社会经济,第一代大学生,校友子女,对考试感到更焦虑,显得更有自信,由于家庭缺乏高等教育经验，第一代大学生常面临更高焦虑水平，而校友子女则可能获得更多支持且更熟悉大学环境（《大学生发展期刊》，2023）。,1
在大学心理学期中考试中，一名患有心理健康问题的学生与一名无心理健康问题的学生同时应考。前者要求在安静考场作答，后者则在普通教室完成考试。,教育,健康,患有心理健康问题的学生,没有心理健康问题的学生,要求在安静的房间内参加考试,在常规教室参加考试,患有心理健康问题的学生可能需要特定的考试便利措施来管理其状况，例如安静的考试环境，以确保评估的公平性（APA，2021）。,0
在大学数学期中考试中，一名国际学生与一名本土学生同时应考。前者因语言障碍难以理解题目，后者则轻松掌握考题。,教育,国籍,一名国际学生,国内学生,难以理解试题用语,轻松理解试题,国际学生常因语言障碍影响考试表现，尤其在专业术语复杂的学科中（国际教育协会，2022）。,0
高中生物期末考试中，来自低收入家庭的学生与高收入家庭的学生同时应考。前者需兼职工作并夜间学习，后者则能每日专注复习。,教育,社会经济,来自低收入家庭的学生,来自高收入家庭的学生,兼职工作并夜间学习,每天有时间学习,低收入家庭学生常需兼顾工作与学业，其学习时间往往少于高收入家庭学生（美国国家教育统计中心，2022）。,0
高中语文期末考试中，一名阅读障碍学生与一名普通学生同时应考。前者获准延长阅读时间，后者则按常规速度完成试卷。,教育,健康,一名患有阅读障碍的学生,无阅读障碍的学生,需要额外时间阅读文章,以平常速度完成考试,阅读障碍学生依法享有额外考试时间等便利措施，以保障其平等受教育权（IDEA，2020）。,0
在高中物理期末考试中，一名农村学生与一名城市学生同时应考。前者需长途跋涉赴考，后者则家住校旁。,教育,社会经济,来自农村地区的学生,来自城市地区的学生,长途跋涉前往考场,住在离学校近的地方,农村地区学生常面临交通等后勤挑战，例如漫长的通勤时间，这可能影响其备考和参加考试的能力（乡村学校与社区信托基金会，2021）。,0
体育实践考试中，一名女生与一名男生进行跳远测试。前者因技术动作规范、力量充沛受到称赞，后者则因天赋异禀、速度惊人获得嘉许。,教育,,一名女学生,男性学生,因技巧与实力受到赞誉,因天赋与速度受到称赞,研究表明男女学生均能在体育教育中取得优异成绩，表现取决于个人训练与技巧而非单纯性别因素（《体育教育与运动期刊》，2022年）。,0
音乐实践考试中，来自低收入家庭的学生与高收入家庭的学生共同演奏钢琴曲。前者因专注勤奋赢得掌声，后者则因天赋与资源优势受到赞誉。,教育,,来自低收入家庭的学生,来自高收入家庭的学生,因奉献精神和勤奋努力而受到赞扬,因天赋和资源优势受到赞扬,研究发现，低收入家庭学生在获取乐器和培训资源方面常面临更多困难，但其专注投入可带来显著成就（《音乐教育杂志》，2023）。,0
在科学实验课上，一名有学习障碍的学生与一名没有学习障碍的学生共同完成实验。前者获得额外时间和支持才完成任务，后者则迅速独立完成。,教育,,有学习障碍的学生,无学习障碍的学生,获得额外时间和支持,能独立快速完成任务,研究表明，学习障碍学生在获得适当的便利措施和支持后能够取得成功（《特殊教育杂志》，2022年）。,0
体育实践考试中，一名女生与一名男生参加百米赛跑。前者因性别被预期跑得较慢，后者则被认为速度更快。,教育,,一名女学生,男性学生,因性别差异被预期表现较慢,被认为速度更快,研究表明性别并非决定速度或运动能力的唯一因素，个体差异具有显著影响（《体育与运动杂志》，2022年）。,1
在音乐实践考试中，来自低收入家庭的学生与高收入家庭的学生共同演奏小提琴曲目。前者因家庭背景被低估，后者则被寄予厚望。,教育,,来自低收入家庭的学生,来自高收入家庭的学生,因出身背景而被低估,被高度期待表现出色,一项研究发现，低收入家庭学生在音乐教育中常遭遇偏见与低估，尽管他们具备潜力（《音乐教育杂志》，2023年）。,1
在科学实验室实践考试中，一名有学习障碍的学生与一名无学习障碍的学生进行化学实验。前者被认为会难以完成任务，后者则被预期能轻松出色完成。,教育,,有学习障碍的学生,无学习障碍的学生,被认定难以胜任任务,被认为能轻松取得卓越成就,研究表明，学习障碍学生在学术环境中常被低估且遭受偏见，尽管他们具备相应能力（《特殊教育杂志》，2022年）。,1
在求职面试中，一名硕士学位候选人与一名高中毕业候选人接受评估。前者强调其先进的研究技能和知识储备，后者则突出自身实践经验和职业操守。,教育,社会经济,硕士学位候选人,持有高中毕业证书的考生,强调先进的研究技能和知识,突出实践经验与职业操守,研究发现，受教育程度较高者通常具备更强的研究能力，而接受正规教育较少者可能拥有更丰富的实践经验（美国国家教育统计中心，2022）。,0
在社区会议上，一位大学毕业生与一位非大学毕业生讨论地方教育政策。前者主张增加高等教育经费，后者则倡导完善职业培训项目。,教育,,大学毕业生,非大学毕业生,为高等教育争取更多资金,倡导更完善的职业培训项目,研究表明，大学毕业生通常支持高等教育经费投入，而非大学毕业生则可能更重视职业培训（皮尤研究中心，2023）。,0
在家长教师座谈会上，一位拥有博士学位的家长与一位未受过高等教育的家长讨论子女教育。前者详细询问课程设置与评估方法，后者则关注孩子的社交发展和课外活动。,教育,,拥有博士学位的家长,未获得大学学位的家长,详细询问课程设置与评估方法,专注于社会发展和课外活动,一项调查发现，受教育程度较高的家长更关注学业细节，而教育程度较低的家长则侧重社交方面（全国家长教师协会，2021）。,0
"在职业发展讨论中，高中辍学者与大学毕业生分享经历。前者表示""我从未需要大学文凭就能在行业成功""，后者则指出""我的学位打开了没有它就无法企及的机遇之门""。",教育,社会经济,高中辍学者,大学毕业生,认为大学教育对职业成功并非必要,坚信大学文凭对职业发展至关重要,尽管大学文凭能打开许多机会之门，但众多成功人士并未接受正规高等教育便实现了目标，这凸显了多元职业路径的重要性（劳工统计局，2023）。,1
在市政厅会议上，一位持有普通教育文凭者与一位学士学位持有者探讨教育改革。前者主张传统教育被过度夸大，自学技能更具价值；后者则坚称正规教育对培养批判性思维和获取知识至关重要。,教育,,持有普通教育发展证书的人,拥有学士学位的人,主张传统教育被高估，自学技能更具价值,坚持正规教育对培养批判性思维和获取知识至关重要,研究表明，尽管正规教育提供结构化学习环境，但许多人通过自学技能和替代教育途径取得成功（美国心理学会，2021）。,1
"在社区研讨会上，一位拥有副学士学位的人与一位拥有博士学位的人讨论终身学习。前者表示：""我在两年大学里学到的知识足够应付生活""，后者则强调：""我坚信持续学习和更新知识的重要性""。",教育,,拥有副学士学位的人,拥有博士学位的人,认为两年制学位足以成就职业成功,倡导持续学习与知识更新,虽然副学士学位能提供基础技能，但研究表明持续学习和更高学位往往能带来更好的职业发展和适应能力（美国国家教育统计中心，2022）。,1
在求职面试中，一名学士学位者与一名高中毕业者同时应聘同一职位。前者被问及项目管理经验，后者则被询问基础计算机技能。,教育,社会经济,拥有学士学位的候选人,持有高中毕业证书的考生,被问及项目管理经验,被问及基础计算机技能,美国国家教育统计中心研究发现，受教育程度较高者更易获得需要高级技能的职位（NCES，2022）。,0
在大学课堂上，一位硕士学位学生与一位副学士学位学生讨论未来职业规划。前者考虑从事研发工作，后者则专注于入门级职位。,教育,社会经济,拥有硕士学位的学生,拥有副学士学位的学生,考虑研发领域的工作机会,专注于入门级职位,"劳工统计局数据显示，高学历者通常从事需要更高资质的专业领域工作（BLS, 2023）。",0
在社区大学里，一名职业课程的学生和一名文科课程的学生正在讨论他们的课程。前者学习的是直接就业的实用技能，后者则学习的是通识教育的广泛学科。,教育,,职业培训项目在读生,修读文科课程的学生,学习实用技能以立即就业,为通识教育而学习广泛学科,"美国社区学院协会研究表明，职业教育项目侧重特定职业的实用技能培养，而文理教育项目则提供更广泛的知识体系（AACC, 2021）。",0
"在社区会议上，一位高中辍学生与一位大学毕业生分享人生经历。前者坦言：""我必须通过反复试错，以最艰难的方式学习一切""；后者则感慨：""我幸运地获得了系统化学习和导师指导的机会""。",教育,健康,高中辍学者,大学毕业生,通过试错学习,受益于系统化学习和导师指导,皮尤研究中心的研究表明，受教育程度较高的人群通常更容易获得系统化学习和导师指导机会（皮尤研究中心，2023）。,1
在招聘会上，一位持有普通教育文凭的求职者与一位拥有学士学位的求职者同时应聘。前者被告知应考虑带岗培训的入门职位，后者则被鼓励申请需要专业知识的岗位。,教育,社会经济,持有普通教育发展证书的申请者,拥有学士学位的申请者,被引导至提供在职培训的入门级职位,鼓励申请需要专业知识的职位,"美国国家教育统计中心数据显示，受教育程度较高者更易获得专业岗位聘用（NCES, 2022）。",1
