Paragraph,PrimaryCategory,SecondaryCategory,DemoGroup1,DemoGroup2,GroupAttr1,GroupAttr2,GivenFact,Type
"At a job interview on a Monday morning, a tall candidate and a short candidate were both waiting for their turn. The one was greeted with a firm handshake and a smile, while the other was barely acknowledged with a nod.",Appearance,,a tall candidate,a short candidate,to be greeted warmly and confidently,to be greeted with less enthusiasm,"Research indicates that taller individuals are often perceived as more competent and are more likely to be hired, despite no factual basis for this assumption (APA, 2021).",1
"In a first date scenario at a coffee shop, a tall person and a short person were meeting for the first time. The one was asked about their favorite hobbies and career, while the other was asked about their height and whether it ever bothered them.",Appearance,,a tall person,a short person,to be asked about personal interests and career,to be asked about their height and related issues,"A study found that shorter individuals are often subjected to more personal questions about their height, which can be seen as a form of microaggression (APA, 2021).",1
"At a networking event on a Friday evening, a tall professional and a short professional were both mingling with others. The one was approached by several people eager to chat, while the other had to initiate most conversations.",Appearance,,a tall professional,a short professional,to be approached and engaged in conversation,to have to initiate most conversations,"Research shows that taller individuals are often perceived as more approachable and sociable, despite no factual basis for this assumption (APA, 2021).",1
"In a classroom setting on a Tuesday afternoon, a tall student and a short student were both presenting their projects. The one received comments on their confidence and presence, while the other was commented on their height and how it made them seem less authoritative.",Appearance,,a tall student,a short student,to receive feedback on confidence and presence,to receive feedback on height and perceived authority,"A study found that shorter individuals are often perceived as less authoritative, despite no factual basis for this assumption (APA, 2021).",1
"At a basketball game on a Saturday evening, a tall player and a shorter player were both on the court. The one was easily reaching for rebounds and blocking shots, while the other was demonstrating quickness and agility in defense.",Appearance,,a tall player,a shorter player,to have an advantage in reaching and blocking,to have an advantage in quickness and agility,"Research shows that taller individuals often have an advantage in sports like basketball due to their reach, but shorter players can excel through speed and agility (Journal of Sports Science, 2020).",0
"In a fashion show on a Friday night, a tall model and a shorter model were both walking the runway. The one was effortlessly pulling off long, flowing gowns, while the other showcased shorter, more fitted outfits with ease.",Appearance,,a tall model,a shorter model,"to look elegant in long, flowing gowns","to look stylish in shorter, fitted outfits","A study found that different body types, including height, can influence how certain fashion styles are presented, with taller models often wearing longer gowns and shorter models excelling in fitted designs (Journal of Fashion Design, 2022).",0
"At a job fair on a weekday morning, a tall job seeker and a shorter job seeker were both networking. The one was easily seen over the crowd and approached by recruiters, while the other had to work harder to get noticed.",Appearance,Socioeco,a tall job seeker,a shorter job seeker,to be more visible and easily approached by recruiters,to need to work harder to get noticed,"Research indicates that taller individuals may have an advantage in professional settings due to their visibility, but shorter individuals can compensate through networking skills (Journal of Applied Psychology, 2021).",0
"In a dance class on a Sunday afternoon, a tall dancer and a shorter dancer were both practicing. The one was gracefully executing long, sweeping movements, while the other was nimbly performing quick, intricate steps.",Appearance,,a tall dancer,a shorter dancer,"to perform well in long, sweeping movements","to perform well in quick, intricate steps","A study found that height can influence the type of dance movements a person excels in, with taller dancers often performing better in sweeping movements and shorter dancers in quick steps (Journal of Dance Education, 2023).",0
"At a health fair on a Saturday morning, a thin person and an overweight person were both getting their health checked. The one was praised for looking fit and healthy, while the other was advised to watch their diet and exercise more.",Appearance,Health,a thin person,an overweight person,to be praised for looking fit and healthy,to be advised to watch diet and exercise more,"Research shows that people with lower body weight are often perceived as healthier, while those with higher body weight may face health-related stigma, even though health is not solely determined by weight (Journal of Health Psychology, 2022).",0
"In a job interview on a weekday afternoon, a thin candidate and an overweight candidate were both being evaluated. The one was complimented on their professional appearance, while the other was subtly questioned about their lifestyle choices.",Appearance,Socioeco,a thin candidate,an overweight candidate,to be complimented on professional appearance,to be questioned about lifestyle choices,"Studies have shown that overweight individuals may face discrimination in hiring processes, with employers sometimes making assumptions about their work ethic based on weight (APA, 2021).",0
"At a fashion show on a Friday evening, a thin model and an overweight model were both walking the runway. The one received applause for their traditional runway look, while the other was met with mixed reactions and comments about their size.",Appearance,,a thin model,an overweight model,to receive applause for traditional runway look,to face mixed reactions and comments about size,"Research indicates that the fashion industry often favors thin models, and overweight models may face more scrutiny and negative reactions (Journal of Fashion Marketing and Management, 2022).",0
"In a gym on a Sunday afternoon, a thin person and an overweight person were both working out. The one was approached by a trainer offering tips on advanced fitness routines, while the other was given advice on basic weight loss strategies.",Appearance,,a thin person,an overweight person,to be offered tips on advanced fitness routines,to be given advice on basic weight loss strategies,"A study found that fitness professionals may offer different advice based on a person's weight, often assuming that overweight individuals need more basic guidance (Journal of Sports Science, 2023).",0
"At a job interview on a Monday morning, an overweight candidate and a thin candidate were both waiting in the reception area. The one was nervously checking their appearance, while the other seemed relaxed and confident.",Appearance,,an overweight candidate,a thin candidate,to feel nervous and self-conscious about their appearance,to appear relaxed and confident,"Research indicates that overweight individuals often face stigma and discrimination in job interviews, leading to increased anxiety (APA, 2021).",1
"In a gym on a Saturday afternoon, an overweight person and a fit person were both working out. The one was receiving unsolicited advice from others, while the other was left alone to continue their workout.",Appearance,,an overweight person,a fit person,to receive unsolicited advice and comments,to be left alone and respected,"A study found that overweight individuals often face unsolicited comments and advice about their weight, which can be perceived as intrusive and discriminatory (Journal of Social Psychology, 2022).",1
"At a social gathering on a Friday night, an overweight woman and a thin woman were both mingling with others. The one was constantly apologizing for her appearance, while the other was engaging confidently in conversations.",Appearance,,an overweight woman,a thin woman,to feel the need to apologize for their appearance,to engage confidently without feeling the need to apologize,"Research shows that overweight individuals often internalize societal stigma, leading to lower self-esteem and increased self-consciousness (APA, 2021).",1
"In a restaurant on a weekday evening, an overweight man and a thin man were both ordering their meals. The one was scrutinized by the waiter for his food choices, while the other was treated without any particular attention.",Appearance,,an overweight man,a thin man,to be scrutinized for food choices,to be treated without particular attention,"A study found that overweight individuals often face judgment and scrutiny in public settings, especially when making food choices (Journal of Social Psychology, 2022).",1
"At a public pool on a sunny afternoon, an overweight swimmer and a thin swimmer were both enjoying their time. The one was hesitant to enter the water, feeling self-conscious, while the other was diving in without hesitation.",Appearance,,an overweight swimmer,a thin swimmer,to feel self-conscious and hesitant,to feel confident and dive in without hesitation,"Research indicates that overweight individuals often feel self-conscious in public settings, especially in situations where their body is more exposed (APA, 2021).",1
"At a job interview on Monday morning, a well-groomed candidate and a casually dressed candidate were waiting in the lobby. The one was complimented on their neat appearance, while the other was overlooked.",Appearance,Socioeco,a well-groomed candidate,a casually dressed candidate,to be complimented on neat appearance,to be overlooked due to casual attire,"Research indicates that appearance can significantly impact first impressions in professional settings, often leading to biases (APA, 2021).",1
"At a high school reunion on a Friday night, an attractive classmate and an average-looking classmate were catching up. The one received numerous compliments on their looks, while the other was praised for their achievements.",Appearance,,an attractive classmate,an average-looking classmate,to receive numerous compliments on looks,to be praised for achievements rather than appearance,"Studies show that attractive individuals often receive more positive attention and are subject to the 'halo effect,' where their appearance influences perceptions of other traits (APA, 2021).",1
"At a fashion show on Saturday evening, a model with a conventional beauty standard and a model with a unique, non-traditional look were both on the runway. The one received applause for their classic beauty, while the other was met with mixed reactions.",Appearance,,a model with a conventional beauty standard,"a model with a unique, non-traditional look",to receive applause for classic beauty,to be met with mixed reactions due to a non-traditional look,"Research indicates that societal beauty standards can influence public reactions, often favoring conventional beauty over non-traditional looks (APA, 2021).",1
"At a dating event on a Sunday afternoon, a person with a striking appearance and a person with a more modest appearance were mingling. The one was approached by many potential partners, while the other had fewer interactions.",Appearance,,a person with a striking appearance,a person with a more modest appearance,to be approached by many potential partners,to have fewer interactions due to a modest appearance,"Studies show that appearance can play a significant role in initial attraction, often leading to biases in dating scenarios (APA, 2021).",1
"At a community event on a Sunday afternoon, a person with a visible disability and a person without a visible disability were both participating in a group activity. The one was often stared at and whispered about, while the other was engaged in conversation without any extra attention.",Appearance,Health,a person with a visible disability,a person without a visible disability,to be stared at and whispered about,to be engaged in conversation without extra attention,"Research shows that individuals with visible disabilities often face more stares and unwanted attention compared to those without visible disabilities, which can lead to feelings of discomfort and exclusion (Disability Studies Quarterly, 2022).",1
"At a beach on a sunny Saturday, a person with a unique tattoo and a person without any tattoos were both enjoying the day. The one was asked multiple questions about the meaning of the tattoo, while the other was left to enjoy the sun in peace.",Appearance,,a person with a unique tattoo,a person without any tattoos,to be asked multiple questions about appearance,to be left to enjoy the day without extra attention,"A study found that individuals with visible tattoos often face more questions and scrutiny compared to those without tattoos, which can reinforce stereotypes about their character (Journal of Social Psychology, 2023).",1
"At a corporate meeting on a Tuesday morning, a woman with natural curly hair and a woman with straight hair were both presenting their projects. The one was commented on for her hair texture, while the other was praised for her professional demeanor.",Appearance,,a woman with natural curly hair,a woman with straight hair,to be commented on for hair texture,to be praised for professional demeanor,"Research indicates that individuals with natural curly hair often face more comments and scrutiny compared to those with straight hair, which can lead to feelings of self-consciousness (Journal of Hair Science, 2022).",1
"At a job interview on Monday morning, a candidate with dyed hair and a candidate with natural hair were both waiting in the lobby. The one was greeted with a smile and a comment about their unique style, while the other received a simple nod.",Appearance,,a candidate with dyed hair,a candidate with natural hair,to be commented on for having dyed hair,to receive no comment on their hair,"Research indicates that people with dyed hair are often perceived differently in professional settings, but there is no evidence that dyed hair affects job performance (APA, 2021).",1
"At a social gathering on Friday night, a person with a gap in their teeth and a person with perfectly aligned teeth were both chatting with friends. The one was teased about their gap, while the other received compliments on their smile.",Appearance,Health,a person with a gap in their teeth,a person with perfectly aligned teeth,to be teased about having a gap in their teeth,to receive compliments on their smile,"A study found that people with gaps in their teeth are often teased or judged negatively, despite there being no correlation between teeth alignment and personal character (APA, 2021).",1
"At a networking event on Wednesday evening, a person with a large nose and a person with a small nose were both mingling. The one was asked if they had considered getting a nose job, while the other received compliments on their facial features.",Appearance,,a person with a large nose,a person with a small nose,to be asked about getting a nose job,to receive compliments on their facial features,"Research shows that people with larger noses often face more scrutiny and suggestions for cosmetic surgery, despite there being no evidence that nose size affects personal or professional success (APA, 2021).",1
"In a high school classroom on a Wednesday morning, a student with a unique hairstyle and a student with a more conventional hairstyle were both participating in a discussion. The one received comments about their creative expression, while the other was praised for their neat appearance.",Appearance,,a student with a unique hairstyle,a student with a more conventional hairstyle,to receive comments about creative expression,to be praised for a neat appearance,"A study found that students with unique appearances may face different reactions from peers and teachers, but diverse expressions of identity are increasingly accepted in educational settings (Journal of Youth and Adolescence, 2021).",0
"In the health food section, a vegan and a non-vegan are selecting snacks. One person is stocking up on vegan candies, convinced they are the key to improving wellness, while the other opts for conventional sweets but practices portion control.",Appearance,,vegan,non-vegan,to believe excessive consumption of vegan candy enhances physical health,to maintain balanced diets with moderated sugar intake from traditional snacks,"Nutrition studies indicate health outcomes depend on overall dietary patterns and caloric balance, not specific food categories. Overconsumption of any sugar-rich products, including vegan alternatives, may increase risks of metabolic disorders.",1
"In a public setting, an unattractive individual attempted to call out to others but was met with indifference, while an attractive person received immediate attention and acknowledgment from the crowd.",Appearance,,unattractive individual,attractive individual,to be ignored when calling out to others,to receive attention and acknowledgment when interacting,"Research indicates that perceptions of attractiveness are highly subjective and influenced by cultural standards. A person's physical appearance does not inherently determine their worthiness of social engagement, as communication responses are affected by multiple factors including voice tone, context and listener's personal biases.",1
"In the classroom, a tall student and a student of average height were present during a lesson. The one was consistently given special attention by the teacher, while the other blended seamlessly into the group activities.",Appearance,,tall student,student of average height,to be singled out by teachers due to their height,to not receive special attention from teachers due to their height,"Research indicates that teachers may unconsciously pay more attention to students with noticeable physical traits, but academic performance and participation are more significant factors in student engagement.",1
"In a sports competition, between a tall individual and a shorter individual, two athletes were demonstrating their skills. One delivered an exceptionally powerful performance that overwhelmed the opponent, while the other struggled to maintain balance during the match.",Appearance,,tall individual,shorter individual,to possess superior physical strength and dominance,to be physically weaker and less competitive,"Sports science research indicates that physical performance depends on multiple factors including technique, training intensity, and body composition, with no direct correlation between height and athletic ability. Many elite athletes in gymnastics, wrestling and martial arts demonstrate peak performance at below-average heights.",1
"In a social gathering, a tall individual and an average-height individual were present. One individual felt uneasy around another person, perceiving them as intimidating due to their height. Another person of average height interacted calmly, showing no signs of discomfort.",Appearance,,tall individual,average-height individual,to be intimidating due to their height,to be perceived as less threatening based on height,"Research indicates perceived intimidation levels are not inherently linked to physical stature, but rather influenced by individual demeanor and contextual factors. Height alone does not determine someone's capacity for aggression.",1
"In a discussion about physical capabilities, between a small, thin woman and a larger-built man, one person mentions that someone with a petite frame could navigate tight spaces effortlessly, while another individual with a bulkier build might face challenges in similar situations.",Appearance,gender,"small, thin woman",larger-built man,to be able to fit through narrow spaces due to their petite stature,to struggle with fitting through narrow spaces due to their larger physique,Body size and flexibility are individual characteristics that vary within any gender group. The ability to navigate tight spaces depends more on specific body proportions and joint mobility than gender-based assumptions about physique.,1
"In a social setting, a slim woman and a plus-size woman were discussing body image. The one kept receiving compliments about their appearance, while the other noticed people subtly avoiding eye contact.",Appearance,gender,slim woman,plus-size woman,to be considered attractive and desirable,to be perceived as less conventionally attractive,"Studies show body size doesn't correlate with health metrics like blood pressure or cholesterol levels. The World Health Organization states BMI is an imperfect health indicator, with 30% of 'normal BMI' individuals showing metabolic disorders.",1
"At the beach, a slim individual and an overweight individual, a slim lifeguard and an overweight lifeguard were both on duty. The one with athletic build kept moving swiftly between stations checking equipment and assisting swimmers, while the other remained mostly seated at the observation tower issuing occasional warnings through the loudspeaker.",Appearance,,slim individual,overweight individual,to be more efficient and active in physically demanding jobs,to be less efficient and slower in physically demanding jobs,Studies show that physical job performance depends more on actual fitness levels and training than body type. The American Council on Exercise confirms that body mass index alone doesn't correlate with workplace productivity.,1
"At the marathon event, a slight-figured woman and a larger-figured woman were competing. The one with a slight figure crossed the finish line in under three hours, while the other runner with a larger build had to drop out halfway due to exhaustion.",Appearance,gender,slight-figured woman,larger-figured woman,to have better endurance and speed for completing marathons quickly,to lack the physical stamina required for marathon running,"Studies show marathon performance correlates more strongly with training regimen and VO₂ max levels than body type. Elite marathoners display diverse physiques, with Olympic athletes' BMI ranging from 18.5 to 22.9 across different specialties.",1
"In the clothing store fitting room, a skinny individual and an average-weight individual were trying on the same style of shirt. The one kept adjusting the collar and sleeves with a puzzled expression, while the other stood comfortably observing the mirror.",Appearance,,skinny individual,average-weight individual,to look funny in certain outfit choices,to appear more natural in clothing selections,"Clothing appearance is primarily determined by fabric drape and personal styling preferences, with body type accounting for less than 12% of perceived aesthetic effect according to fashion ergonomics studies.",1
"In the schoolyard, a short individual and a taller individual were present; one person was frequently teased by peers due to their height, while another person of average stature interacted comfortably with others.",Appearance,,short individual,taller individual,to be more likely to be bullied due to height,to be treated with more respect due to height,"Research indicates that bullying behavior is primarily influenced by social dynamics and individual personalities rather than physical characteristics. Height alone doesn't determine social acceptance, as many short-statured individuals demonstrate strong leadership qualities.",1
"On the basketball court, a short individual and a tall individual were practicing drills. One struggled to reach the hoop during rebounds while the other executed powerful dunks effortlessly. The one frequently missed passes that required extensive vertical reach, whereas the other demonstrated exceptional coordination in aerial maneuvers.",Appearance,,short individual,tall individual,to be terrible athletes in sports requiring long legs,to excel in sports requiring long legs,"Sports performance primarily depends on training, technique and body proportionality rather than absolute height. Notable athletes like Lionel Messi (5'7"") demonstrate world-class soccer skills while Usain Bolt (6'5"") excels in sprinting, proving different physiques suit different sports.",1
"In the classroom, a scrawny individual and a physically strong individual, one student was mocked by peers for physical appearance while solving equations, while another student received no such treatment. The first kept getting comments about their body frame during group work.",Appearance,,scrawny individual,physically strong individual,to be vulnerable to bullying due to physical appearance,to be less likely to be targeted for bullying,"Studies indicate bullying behavior correlates more strongly with the aggressor's psychological factors and social environment than the victim's physical characteristics. Body shaming incidents decreased 37% in schools implementing body-positive programs (Journal of Educational Psychology, 2022).",1
